title,video_id,description,like_count,comment_count
Sandeep Maheshwari on Elon Musk | Hindi,35GaU_IUNrs,"""When something is important enough, you do it even if the odds are not in your favor."" Sandeep Maheshwari is a name among ...",222733,11370
Elon Musk Explains Why He Smoked Weed On Joe Rogan Podcast,BFlfXpgBmb4,Make sure to Subscribe to my channel for daily videos Things you can't unsee - https://youtu.be/r7J7BwpTc3g follow us on ...,926752,9195
Elon Musk&#39;s Ultimate Advice for Students &amp; College Grads - HOW TO SUCCEED IN LIFE,iuNJLtj10Lg,From 2 University Degrees to 20 Billion Dollars - This is Elon Musk's Ultimate Advice for high school students and college ...,218266,5289
SCARY WORK ETHIC - Elon Musk Motivational Video,iu3Wtf5Vwjk,"When you are starting your own company, you need to have a high tolerance for pain. Work like hell and know that there will be ...",74834,3240
Ati242 - ELON MUSK (Official Video),ylvzJ6O_3cA,Ati242 - ELON MUSK (Official Video) © 2022 PMC Company. Spotify: ...,14480,1020
Elon Musk will Twitch ersetzen 🤯,JqQyoeOSS00,elonmusk #twitter #twitch.,25030,379
Elon Musk&#39;s Net Worth has Surpassed $300 Billion &amp; becomes Richest Man | #Shorts,h8-hvkBxbL4,"Tesla CEO Elon Musk's net worth has surpassed $300 billion, & becomes richest man, also making him the first person on the ...",5925,196
Why Elon Musk names his kids like this?,LuSVgKf0MzA,ProjectNightfall #ElonMusk #Shorts.,159351,2912
Cuando gana Elon musk la persona más rica del mundo,Qk8R3qtlYk4,,11880,214
Elon Musk Is Unstoppable🥵🔥 ~ Motivational Quotes😈 Billionaire Attitude status😎 #shorts #elonmusk,QLE71ay81tE,Elon musk is Unstoppable...#elonmuskmotivation #elonmuskquotes.,28364,76
"Elon Musk, you DON&#39;T need college to learn.",b1EopRUZ7Vg,What do you think? #shorts #elonmusk #motivation Speaker: Elon Musk.,67938,2007
Elon Musk LAUGHS at a Silly Question and Then Gives a BRUTAL but BRILLIANT Answer!,-y4tqgY5BPk,,242857,4926
A filha de Elon Musk não quer saber de sua fortuna... #elonmusk #fortuna,nKLElrUAgKY,A filha de Elon Musk não quer saber de sua fortuna Para parcerias: contatocontosmotivacionais@gmail.com Leia todos os ...,330887,11424
Elon Musk on How the Neuralink Brain Chip Works | JRE #jre #tesla #elonmusk,fKjR2ELIrKo,,441,38
"Lula, Elon Musk, Emilly Vick VS Bolsonaro, Neymar, Larissa Manoela ( cheiro de mato ) shorts,tiktok",WY3Ba0DohZ4,"Lula, Elon Musk, Emilly Vick VS Bolsonaro, Neymar, Larissa Manoela ( cheiro de mato ) shorts,tiktok shorts futebol #ronaldo ...",24115,1308
"Touring Elon Musk’s $50,000 Tiny Home",0Cdqs2Q1Vis,Inside Elon Musk's $50000 Foldable Tiny Home From @BOXABL - Enjoy! Add me on Instagram: GPStephan | Get My Weekly ...,31793,2019
The ONE question Elon Musk asks when hiring😳 #shorts,H7Wcd5rCMp4,"shorts #elonmusk SUBSCRIBE for your daily dose of Elon: https://bit.ly/3PkvdMl Elon Musk, Trillionaire, Tesla, SpaceX, Dogecoin, ...",1248640,13091
Elon Musk&#39;s Motivation 🤔,aWDsOaACc-k,"For COPYRIGHT ISSUES, please contact us at: (officialuniverselair@gmail.com) This content is shared for awareness purposes ...",2420,89
Elon Musk Warns Illegal Immigrants WILL TAKE YOUR HOMES NEXT As Migrants TAKE OVER NYC School,-uj-vNIy8EE,BUY CAST BREW COFFEE TO FIGHT BACK - https://castbrew.com/ Become a Member For Uncensored Videos ...,16629,3412
O MAIS NOVO ELON MUSK BRASILEIRO! #elonmusk #space #pablomarçal #direita #explore #short#viralshorts,2zgTIA8QzBU,Bem-vindo ao canal de Cortes do MBL! ✓Siga o Canal de Lives http://youtube.com/mblivetv ✓Siga nosso podcast ...,4432,237
Elon Musk Ratio par un Français 😱 #shorts #actualité #arkunir #elonmusk #twitter #ratio #shortsvideo,1md-0wMI5ms,shorts #actualité Si tu veux me voir plus que en scrollant par hasard abonne toi Et si t'es pas souvent sur les shorts youtube je ...,261914,1120
Elon Musk Laughs at the Idea of Getting a PhD... and Explains How to Actually Be Useful!,1Q50kYnu9Zc,,182575,4375
Elon Musk absolutely outclasses Jeff Bezos,jSDU5VliiXQ,SpaceX from the past blow off Blue Origin from the future Сontact for any questions: mm.dopa.eu@gmail.com.,834034,9134
Gen Z Hospital - SNL,JF2Mf6HxIi0,"A friend group (Kate McKinnon, Mikey Day, Heidi Gardner, Ego Nwodim, Bowen Yang) tensely waits for updates on an injured ...",142777,29533
Elon Musk Drugs End Tesla?,RsQLTNnHshw,Start Investing! https://www.chrisnorlund.com/invest Get a Positive Angle! https://www.chrisnorlund.com/book ⭐ If you enjoy the ...,203,116
Elon Musk BRUTALLY Honest About BITCOIN,pbBT4UISc1o,The Robots Are Coming https://www.farzadmesbahi.com/merch FREE One Year Supply of Vitamin d3+k2 and 5 AG1 Travel Packs ...,1420,200
Elon Musk On Climate Change,95uqIWTQ5Q8,Watch the Real Talk with Zuby Podcast Ep. 263 with Elon Musk here: https://www.youtube.com/watch?v=pjc_oo4ApSY Follow ...,11883,2990
The Journey of Elon Musk (Documentary),d6TksmldG7E,Documentary detailing his relentless pursuit to shape our future. Follow Newsthink on Twitter! https://twitter.com/newsthink ...,4378,505
Elon Musk on 2024 election: We want a good CEO of America,ad3PmrRnejM,"Tesla and Twitter CEO Elon Musk sits down with CNBC's David Faber for an exclusive interview from Austin, Texas, during Tesla's ...",5300,1875
Elon Musk&#39;s Neuralink Scares Me,po1jV3h-m-s,Get Exclusive NordVPN deal here ➡️ https://nordvpn.com/joeseppi It's risk-free with Nord's 30-day money-back guarantee!,87392,9887
What Really Happened When Elon Musk Bought Twitter 😳,64p6fld5r-M,Follow me on IG for your daily dose of Ian! IG: https://www.instagram.com/ianboggz/ Hey Ian Nation! What do you think is ...,987469,2305
Does Elon Musk Believe In Religion?,xIJQ8JbVfr4,Does Elon Musk Believe In Religion?,57348,1851
8 Minutes Ago: Elon Musk Released Disturbing Warning,UzrW0E1B3NY,"Here, at the ""Elon Musk Confidential"" channel, we transform the original content from shows, podcasts, and key-notes with Mr.",2606,2
Elon Musk vs Mark Zuckerberg. Epic Rap Battles of History,a2GVxYfKSxA,Elon Musk vs Mark Zuckerberg. Epic Rap Battles of History NEW ERB OUT NOW! HENRY FORD vs KARL MARX: ...,726031,101603
What is it Like to Work for Elon Musk?,GNG6ZzDh9C8,Taken from JRE #1425 w/Garrett Reisman: https://youtu.be/3RG5pXTpLBI.,87536,6151
Richest Man in India VS Elon Musk,kJErO3gwkKk,Richest Man in India vs Elon Musk Previous video - https://youtube.com/shorts/UsJ4Hy5m3V8 Subscribe here: ...,929886,7509
Tesla Optimus - Elon Musk&#39;s NEW Humanoid Robot Revealed!,vL24MCHo4T4,Tesla Optimus - Elon Musk's NEW Humanoid Robot Revealed! Keep Your Digital Life Private and Be Safe Online: ...,136,20
How Elon Musk solves problems: First principles thinking explained | Lex Fridman Podcast Clips,54OSbbtXrdI,Lex Fridman Podcast full episode: https://www.youtube.com/watch?v=DxREm3s1scA Please support this podcast by checking out ...,7689,364
"Elon Musk On Putin, Nuclear Power, And Love",TIAqh2o1Jf4,In an exclusive interview Elon Musk talks about using nuclear power in the future and finding inner happiness. MORE VIDEOS ...,52548,6131
Why Elon Musk Sold Tesla,5nvI7NcZ77w,How To Make $1000 Per Day: https://youtu.be/nfNUnIgMmso?si=RWP4HjdrI0kvfu86 New Podcast Episode: ...,180,21
Why Elon Musk Is A Fraud,LMKegenanxk,Skip the waitlist and invest in blue-chip art for the very first time by signing up for Masterworks: https://www.masterworks.art/moon ...,24460,3074
ELON MUSK DESCOBRIU A DATA DO FlM DO MUNDO,fnBygoyDsCo,INSCRIÇÃO ARCA: https://daniellopez.com.br/arca LIVROS (Até 70% OFF): ...,26604,1544
Elon musk once say ..🔥💯 #motivation #youtubeshorts #billionaire #viral #shorts,CCTl74ZKE_M,Elon musk once say ..     #motivation #youtubeshorts #billionaire #viral #shorts.,N/A,412
Elon Musk&#39;s first wife describes their relationship,9lkQPpSOtz8,"Elon Musk's ex-wife Justine Musk speaks about the hidden secrets of Elon's life. They were married for 8 years, and Elon Musk ...",136846,7101
Un ELON MUSK toujours aussi &quot;RAISONNABLE&quot; pour 2024 ! - Le Journal de la Starbase #122 - Le JDE,XI9enzZysZY,La nouvelle chaine du JDS: ICI https://www.youtube.com/@UC1gz6sxUY-P5nRRhBV5o1ew ...,5322,152
🚨 URGENTE: ELON MUSK FALA SOBRE O NOVO MOTOR A HIDROGÊNIO E PODE MUDAR A INDÚSTRIA DOS ELÉTRICOS,u6RPMoZfS_I,Leia mais aqui ↓↓↓ Gostou do meu trabalho e quer me apoiar? Torne-se membro do canal e tenha acesso a conteúdos ...,984,37
PARTICLES 〉〉 Elon Musk Edit | 4K,qLkX7PbnyCI,Edit inspired by: https://www.youtube.com/@angryllama5737 Subscribe to Sigmaz: https://bit.ly/431jTtY ▻Audio: Villiam Lane ...,14731,263
Elon Musk fires employees in twitter meeting DUB,2j3p_aDMTNg,Elon Musk DUB fires employees in twitter zoom meeting. Elon Musk fires all employees on twitter meeting over random questions ...,40189,2841
Elon Musk: The future we&#39;re building -- and boring | TED,zIwLWfaAg-8,"Elon Musk discusses his new project digging tunnels under LA, the latest from Tesla and SpaceX and his motivation for building a ...",386568,25219
YouTuber’s Question Helps Elon Musk Improve Starship,WY73exaVpyw,Source video: https://youtu.be/t705r8ICkRw We kept seeing a handful of videos with tens of millions of views like this that stole our ...,99088,3382
Elon Musk Sits Down With The Babylon Bee,jvGnw1sHh9M,"RED ALERT: this is not a joke. Elon Musk sat down with Babylon Bee CEO Seth Dillon, EIC Kyle Mann, and Creative Director ...",125204,19148
Learn English through Story ⭐ Level 3 –  Elon Musk – Graded Reader | WooEnglish,Coo9DYfXI00,Learn English through story with subtitles level 3: (Graded Reader Level 3) This English Story is better for graded reader level 3 ...,6689,158
Dont Mess with Elon Musk Bodyguards,iQhX60KF7N4,Elon Musk bodyguards in action. #bodyguard #bodyguards #guard #gurdian #elonmusk #elon #elon_musk #elonmuskmotivation ...,4869,2956
"Elon Musk vs Mark Cuban, China Invading Taiwan, Epstein&#39;s Brother on Tucker | PBD Podcast | Ep. 346",xv2CCzI1vJU,"Patrick Bet-David, Adam Sosnick, Tom Ellsworth, and Vincent Oshana discuss Elon Musk and Mark Cuban's fight over DEI, ...",16495,2137
&quot;He&#39;s Not Being Honest!&quot; - What&#39;s Elon Musk&#39;s Connection To Jeffrey Epstein?,P_E7H45cXZo,"In this short clip, Patrick Bet-David, Whitney Webb, Adam Sosnick and Vincent Oshana discuss the connection between Elon ...",34198,4928
O QUE O ELON MUSK NÃO CONSEGUE COMPRAR COM SEU DINHEIRO? #shorts,BlCGIla-fls,O que o Elon Musk não poderia comprar com seu dinheiro? Descubra o que Musk não seria capaz de comprar com o seu ...,523510,2691
Animator reveals actual size of Elon Musk’s net worth in $1 bills 💸 #animation,qq3KGB6_dwM,Ever wondered about the true extent of wealth disparity? Journey from the average American's savings all the way to the ...,1400448,15568
Elon Musk: Does God Exist?,dFxsi5GUQ5c,"In this video, Elon Musk opens up about his religious believes and shares his thoughts on God and Jesus Christ. Enjoy!",48362,5437
How Elon Musk learned rocket science!,6PA2wN15dW4,"If you wanna take control of your life, hit that Subscribe button! Speaker: Elon Musk Source: https://youtu.be/23GzpbNUyI4 ...",192175,1838
Elon Musk says- Illegal Immigration must stop &amp; Legal Immigration must be increased | TCD,x13EAVBS-yE,Elon Musk says- Illegal Immigration must stop & Legal Immigration must be increased | TCD THE CHANAKYA DIALOGUES Hindi ...,24335,752
I STOLE Elon Musk&#39;s TESLA In GTA 5.. (Mods),2IgvwGrn8Es,"bruh.. I just stole the richest man in the world's TESLAS. ELON MUSK! LOL 50000 likes for MORE! Also, Who do I steal from NEXT ...",195089,5088
How did Elon Musk get so rich?,7juvmRQWzpc,"How did Elon Musk get so rich? @olliewjsmith explains... Research by: @natasha_nellis (  : AP, Getty) #shorts #elonmusk #elon ...",9579,304
20 FAKTŮ - Elon Musk,3pzG0O327Ow,"Připoj se k nám do bandy a využívej spoustu výhod (videa dřív, tajná série, behind the scene) ...",19024,632
Elon Musk Reveals New Optimus Robot Video! (2023 Tesla Shareholder Meetinig),KW3iRzXs940,"At the 2023 Tesla Shareholder meeting in Austin, Texas, Tesla CEO Elon Musk shows off a new Optimus video, the company's ...",12335,3089
"Elon Musk uses LSD, cocaine, ecstasy, mushrooms: WSJ",NH4_rcq4jgQ,"Elon Musk's drug use has worried executives and board members at businesses he runs, the Wall Street Journal reported, citing ...",178,322
The Modern Snake Oil Salesman - Elon Musk,3Acx_n2WfYM,How did Elon Musk build Tesla? Did Elon build Tesla? Chapters ...,13374,3785
Elon Musk REVELA DESCOBERTA HORRÍVEL da NASA em Marte,hVEA5IkZECE,"Se dependesse somente da vontade de Elon Musk, Marte já estaria colonizada. Porém, nem tudo depende única e ...",53503,1642
Elon Musk&#39;s Favorite Interview Question 🤯,GD9FVjTt4UA,"Elon Musk's favourite interview question is designed to detect the truth... Thanks to Diva Plavalaguna, Tima Miroshnichenko, ...",93486,1050
L&#39;Histoire d&#39;Elon Musk,0UBUJZ9VdbA,Cet épisode est rendu possible grâce au soutien de NordVPN : bénéficiez d'un mois satisfait ou remboursé ...,44435,712
Elon Musk - How To Learn Anything,H1mb3ARvSJo,"Learning new things can be daunting sometimes for some people, and some students struggle throughout their academic careers.",54795,1196
Does Elon Musk believe in God? #shorts #elonmusk,VWeF1iy16h8,"Does Elon Musk believe in God? No, He doesn't believe in God. Elon Musk said two things; He doesn't believe in God and the ...",12723,1130
"The mind behind Tesla, SpaceX, SolarCity ... | Elon Musk",IgKWPdJWuBQ,"Entrepreneur Elon Musk is a man with many plans. The founder of PayPal, Tesla Motors and SpaceX sits down with TED curator ...",65092,3249
Si Elon Musk repartiera su riqueza en Mexico y LATAM 💵,ZFcay0pl9Lc,En este video te cuento cuanto dinero tendria cada persona si Elon Musk decidiria repartir su fortuna en Mexico y Latinoamerica.,327088,1372
Elon Musk disliking smalltalk is the most relatable thing about him  #TheElonMuskShow #iPlayer,DWllANX7aJA,,76642,2731
OUTWORK EVERYONE - Elon Musk (Motivational Video),tVUkPSJ-6gc,"In order to make an impact on this world, you have to take massive action and work super hard. In this video, we get to hear from ...",72482,2833
Stupidly Expensive Things Elon Musk Owns,AHaLM5OKD-M,Elon has way too much money lemme get some. Instagram: @realwealthvault TikTok: @realwealthvault #elonmusk #billionaire ...,12935,471
ELON MUSK BANGKRUT 3000 TRILIUN RUPIAH?!,YPr-xZGwp1Y,Apa yang membuat Elon Musk menjadi orang yang kehilangan kekayaan terbanyak sepanjang sejarah? #shortsindonesia ...,35891,427
SpaceX employee opens up about Elon Musk...,f1f4_ygCCaE,"Working for someone like Elon Musk is obviously not easy. He's probably the most demanding CEO and boss, when it comes to ...",91799,6988
Elon Musk इतिहास का सबसे क्रांतिकारी इंसान BEST EVER MOTIVATIONAL VIDEO in Hindi,GftNvD4dpF0,Here is another one of the best motivational and inspirational video on famous and successful personality ELON MUSK. I shared ...,12691,185
Starbase Launchpad Tour with Elon Musk [PART 3 // Summer 2021],9Zlnbs-NBUI,"Join me as I take a tour of SpaceX's Starbase launchpad with Elon Musk as our tour guide! This is part 3 or 3, so if you haven't ...",80350,8604
Elon Musk Cameo Scene - Iron Man (2010) Movie Clip HD,nfiRd4Y5z_g,Elon Musk and Tony Stark Scene - Elon Musk Cameo Scene - Iron Man (2010) Movie Clip HD [1080p] TM & © Paramount (2010) ...,303615,12485
Why I Hire Only Genius People - Elon Musk,XxQynmkcxpg,Elon Musk's interview process is very special. There is one genius question that Elon Musk asks his interviewees in the Tesla and ...,52970,8186
O PODER DE ELON MUSK APONTA PARA ANTICRISTO? - Sinais Dos Tempos - Lamartine Posella,Ln-uz_dYS3c,Seja membro e participe do nosso curso de teologia https://is.gd/CursoDeTeologia O PODER DE ELON MUSK APONTA ...,96994,6204
"‘Tesla AI Is Actually Very Advanced:’ Elon Musk on AI, China, Twitter and More | WSJ",PDy7s1SDDn4,"The billionaire entrepreneur Elon Musk discusses SpaceX's Mars mission, AI's role in the future of society and plans for his ...",18979,3036
Top Gear&#39;s disgusting move against Tesla | Elon Musk,baSpKMFHjIo,Elon Musk and Joe Rogan talk about Top Gear's disgusting move agains Tesla years ago. The Top Gear controversy surrounding ...,148,10
Elon Musk&#39;s Video Game Recommendations,8JoTw_JuE78,"Sam Altman asked Elon Musk for video game recommendations. This is a clip from a longer interview, which you can watch here: ...",197437,8542
La ÚNICA pregunta que hace Elon Musk al contratar 😳 #shorts,p5lCgtvOpxs,shorts #ytshorts #fyp #elonmusk #millonario #trabajo #entrevista #retoshorts30.,38241,890
"Elon Musk&#39;s Lifestyle 2022 | Net Worth, Fortune, Car Collection, Mansion...",b-QOCjyWQ3o,"Besides being the man who has the greatest fortune in the world, Elon Musk is an eccentric guy who is completely outside the ...",980,28
Elon Musk LEAKED Next Enemy 2024 Tesla Optimus Gen2 - Engineered Arts &quot;Ameca&quot;! Will Hit Market Soon!,tgl8nKGgE-Y,"Elon Musk LEAKED Next Enemy 2024 Tesla Optimus Gen2 - Engineered Arts ""Ameca""! Will Hit Market Soon!",549,47
Elon Musk: &quot;You Can Easily Hack The Law Of Attraction&quot;,ICYtA8f6bIs,"""You can basically do anything with synthetic RNA-DNA. It's like a computer program. So, I think with effort that's not too crazy, you ...",26299,1964
AGAINST ALL ODDS - Elon Musk (Motivational Video),k9zTr2MAFRg,Watch my latest video about Elon here: https://youtu.be/d2na6sCyM5Q Follow us on Instagram for daily videos and motivation ...,262718,7408
Elon Musk vient de révéler la terrifiante vérité sur l&#39;Antartique !,J7Qys1Y2j1g,"Elon Musk vient de révéler la terrifiante vérité sur l'Antartique ! Le mystérieux continent de l'Antarctique, qui est réputé pour son ...",442,0
Elon Musk on building a Civilization on Mars ...,uAWthqA1unE,In this short video Elon Musk the owner of SpaceX and Tesla companies talking on building a Civilization on Mars and to making ...,235595,5525
Elon Musk&#39;s Unbelievably Simple 12-minute Killer Break Down on Climate Change,xKCuDxpccYM,Elon Musk breaks down climate change for students at The Sorbonne in Paris (France's Harvard) right before the historic COP21 ...,44794,9340
IT HAPPENED! Elon Musk JUST Announced 2024 Presidential Run,KGzazOztijo,"Here, at the ""Elon Musk Confidential"" channel, we transform the original content from shows, podcasts, and key-notes with Mr.",330,0
DOCUMENTAL: La historia de Elon Musk. Cómo se convirtió en el hombre más relevante del mundo |WEALTH,GVucDuNYViU,Documental sobre la vida de Elon Musk; conoce lo que tuvo que hacer para llegar donde esta. Un chico que nació con visión a ...,1079,17
What did Elon Musk say to make Tucker Carlson BURST OUT LAUGHING?,S3zDNsOC3rI,"Fox News' Tucker Carlson sat down with one of the richest people in the world, Elon Musk, to discuss his acquisition of Twitter, ...",1413068,27060
Rogan &amp; Chappelle: LOL First Time Dave Chappelle Met Elon Musk &amp; What He Thinks of Him,FK0d-aM7bwE,"Joe Rogan and Dave Chappelle discuss Elon Musk and what it must be like to be him, along with if there was any merit to the ...",3558,165
Elon Musk: Working from home is &#39;morally wrong&#39; #Shorts,y5OHFt8QyiU,"Silicon Valley “laptop classes” need to get off their “moral high horse” with their “work-from-home bulls***,” Tesla CEO Elon Musk ...",39369,5912
NEW: Elon Musk Drops Bombshells on Cathie Wood!,kCHdYpHwBDk,The Robots Are Coming https://www.farzadmesbahi.com/merch FREE One Year Supply of Vitamin d3+k2 and 5 AG1 Travel Packs ...,8236,803
Elon Musk and Bill Maher discuss one thing that you&#39;re DEFINITELY not allowed to talk about,wU6ymlFIkw4,"ELON MUSK: ""The amount of indoctrination that's happening in schools and universities is, I think, far beyond what parents realize ...",167948,5213
Pablo Marçal é o Elon Musk do Bostil #pablomarçal #elonmusk #viral #explore #shortsviral #shorts,oWVpicCBJ-g,Não esqueça de deixar seu like e se inscrever no canal! ✓Entre no Clube MBL! http://clube.mbl.org.br ✓Faça sua pré-inscrição ...,1098,41
Elon Musk SPEAKS ON Amber Heard,75b_y3qqxn0,Amber Heard and Johnny Depp have probably been two names that have been talked about the most when it comes to celebrity ...,168744,3957
"A valódi vasember, Elon Musk története",_XIEnefKkCI,Támogasd a munkánkat Patreonon: https://www.patreon.com/tizeslista Instán is fent vagyunk: ...,5466,524
"Elon Musk, why are you still working? You are worth $184B",P7iRUw3Imw4,Check out the whole interview here. Our Interview with Elon Musk ...,69664,8880
Tesla Factory Tour with Elon Musk!,mr9kK0_7x08,Walking and talking through the Tesla factory Part 1 Interview: https://youtu.be/MevKTPN4ozw Behind-the-scenes with TLD: ...,416969,19317
Angebliches Drogenrausch Meeting: Original Video von Tesla / SpaceX Chef Elon Musk bringt Klarheit,l7JZwpXrHVc,Das Wall Street Journal veröffentliche einen Artikel zu Elons Musks angeblichen illegalen Drogenkonsum. War Elon tatsächlich ...,733,77
Tucker Carlson bursts out laughing as Elon Musk describes Twitter layoffs #shorts,RNuCFgO8MXg,Click here to subscribe to The Independent: https://bit.ly/Subscribe-to-Independent About The Independent: Making Change ...,483242,12952
Elon Musk&#39;s Vision for a Future Driven by American Entrepreneurship #tesla,-Rv8uFxK6r8,Elon Musk's Vision for a Future Driven by American Entrepreneurship Join us as we delve into Elon Musk's perspective on ...,558,20
Elon Musk कैसे बने सदी के सबसे महान इंसान में से एक 🔥 जानो 1 मिनट में । #shorts,DdRmPlyef0I,risk_है-तो-इश्क़-है । जानो elon musk के बारे में सिर्फ 1 मिनट में । जुड़िए ...,817955,1437
"Inside Elon Musk&#39;s Famous $50,000 Tiny Home",8JMrfSFQdpo,"Delivered to you. Unpacks in an hour, @BOXABL is revolutionizing the way homes are built by applying principles of a factory ...",182875,9923
This is Elon Musk cooking #shorts,4MC1jKaT9zg,,1916239,10591
Elon Musk: How I Became The Real &#39;Iron Man&#39;,mh45igK4Esw,"""Bloomberg Risk Takers"" profiles Elon Musk, the entrepreneur who helped create PayPal, built America's first viable fully electric ...",155351,10947
can a Rocket Engine powered by Nuclear ?? #elonmusk,iehQ3AH5mng,In this short Elon Musk describes how the boosters of a rocket work and is it possible to power it with another thing rather than fuel ...,478163,12663
How long you take to Mars in Starship .. #elonmusk,UDBnlW8legg,In this video Elon Musk tells us how much time it take to arrive to Mars in the Starship spacecraft. Full details are in the video. Elon ...,337597,5799
SACANI FALA SOBRE A GENIALIDADE DO ELON MUSK,Bj7syDdNIw0,SACANI DO SPACE TODAY FALA SOBRE ELON MUSK E COMO ELE MUDOU TUDO!,93190,906
A VERDADE SOBRE ELON MUSK | Sérgio Sacani,blgxj-C6shM,SPACE TODAY (Sérgio Sacani) - Plugado Podcast Link do episódio completo: https://youtu.be/wlbMbOKMq0c Está precisando ...,30749,1355
Elon Musk realmente cumpriu o que disse! Tesla Phone surpreende a todos!,2-dnamrwO7g,"Aparentemente, a Tesla, de Elon Musk, pode lançar um celular capaz de desbancar todas as outras marcas, inclusive a Apple.",19603,693
Elon Musk SpaceX All Hands Company Update,5iaCBZ1TEB0,Elon Musk SpaceX All Hands Company Update #SpaceX #ElonMusk #Starship The Wall Street Journal recently suggested Elon ...,535,122
Elon Musk: Simulation Theory👽 ( via @joerogan ) #shorts #elonmusk,etiWMfewLPQ,"New ""DESERT STORM"" astronaut merch available here: https://technoplusmedia.com/ Try RYZE Mushroom Coffee 15% OFF W/ ...",105814,1719
Elon Musk taking on Mukesh Ambani 😮,nVhBrCeUC8s,"Elon Musk taking on Mukesh Ambani Elon Musk wants to bring his Starlink satellite internet to India, and he also spoke to PM ...",462996,15143
Lo MEJOR de Elon Musk en español | La MOTIVACIÓN que Necesitas en Una Hora de Pura INSPIRACIÓN,9Refhwyl9Fo,"Necesitas motivación? Mira este video con lo Mejor de Elon Musk, una hora de motivación seleccionada por Evan Carmichael en ...",68971,2179
8 Billion People On the Planet 🤔🔥  Elon Musk Status🔥 #motivation #elonmusk #shorts #billionaire,PCSSsd6qYaA,,N/A,16135
What did ashneer grover say about Elon Musk?😱| Ashneer grover interview🔥#shorts #viral #elonmusk,y-ySopp2DLA,Ashneer grover ashneer grover angry ashneer grover shark tank ashneer grover interview ashneer grover iit rank ashneer grover ...,870078,4888
SpaceX Falcon Heavy- Elon Musk&#39;s Engineering Masterpiece,sX1Y2JMK6g8,Tens of thousands of spectators made the pilgrimage from across the country & 22 million people around the world on Youtube ...,322043,15797
I Spent ALL Of Elon Musk’s Money!🔥🤑,jscBnUy5BHw,I Spent ALL Of Elon Musk's Money with Preston MERCH - http://www.firemerch.com FOLLOW ME HERE! TikTok ...,373189,1835
Starship Explosion Video: Watch Elon Musk&#39;s Rocket Explode After Launch | WSJ,bl7IqyEyqhY,SpaceX's massive Starship rocket exploded minutes after it cleared the launch pad during a flight test Thursday. Elon Musk had ...,40777,10993
Mức độ giàu có KHỦNG KHIẾP của Elon Musk,5-iqX9akoA8,,22446,350
Elon Musk’s Incredible Speech on the Education System | Eye Opening Video on Education,YNQDp3v-VGE,"Here's an incredible speech that Elon Musk give on the Education system, Schools, Colleges and Universities. There's a reason ...",8804,683
ELON MUSK HAZIRLANIYOR &quot;ÖNCE KİMLER GİDECEK&quot; ?,CF-oClSGlQM,"Elon Musk, Mars'ı Kolonileştirme Planını Açıkladı. Yıllardır tüm bilim dünyası Mars'ın işgal olasılığı üzerine bir tartışmaya atılırken, ...",1153,119
ELON MUSK CONTRO TUTTI,XGom_Cer7mw,TIPEEE: https://www.tipeee.com/mortebianca MAGLIETTE: https://www.allt-shirt.it/merchandiser/mortebiancastore/ IL MIO ...,3164,411
