title,video_id,description,like_count,comment_count
&quot;We will occupy Mars In 8 years!&quot; - Elon Musk Delivers Inspiring Speech (NEW),-LtMDhfOPIE,Elon Musk speech - better than Elon Musk interview Source: https://twitter.com/elonmusk/status/1745946082150867075.,1400,271
"Elon Musk on Advertisers, Trust and the “Wild Storm” in His Mind | DealBook Summit 2023",2BfMuHDfGJI,"The tech billionaire Elon Musk has come to define innovation, but he can also be a lightning rod for controversy; he recently ...",61946,N/A
"Elon Musk: War, AI, Aliens, Politics, Physics, Video Games, and Humanity | Lex Fridman Podcast #400",JN3KPFbWCy8,"Elon Musk is CEO of X, xAI, SpaceX, Tesla, Neuralink, and The Boring Company. Thank you for listening ❤ Please support this ...",138829,17219
Elon Musk SpaceX &amp; Starship Presentation!,r8GZ0H0xSFo,The Robots Are Coming https://www.farzadmesbahi.com/merch FREE One Year Supply of Vitamin d3+k2 and 5 AG1 Travel Packs ...,5488,517
Elon Musk to advertisers who are trying to ‘blackmail’ him: ‘Go f--- yourself’,U_M_uvDChJQ,Elon Musk sits down with Andrew Ross Sorkin at the 'New York TImes' DealBook Summit' on a wide-ranging interview including ...,68928,25280
"Elon Musk Shares Video Of Footage EXPOSING Migrant Centers, US Govt. Spends Over 80k Per Migrant",IXWxa0lJwmE,FOLLOW BASTE RECORDS AT - https://twitter.com/basterecords SUPPORT THE SHOW BUY CAST BREW COFFEE NOW ...,13000,2331
"Elon Musk, Alex Jones, Andrew Tate In WILD Conversation",niOugyy7L3Y,Join Patreon: https://www.patreon.com/solvingthemoneyproblem ▻ FREE 1 Yr Supply of Vitamin D + 5 AG1 Travel Packs ...,19883,4598
Elon Musk targets Alaska Airlines for putting DEI over safety after door scare,km-tTxX2KSM,FreedomWorks chief economist Steve Moore analyzes the impact of DEI initiatives on corporations and Americans and discusses ...,3427,982
Elon Musk Vicious Response to School Being Vacated for Migrants,qse6Id4Hsxc,Dave Rubin of “The Rubin Report” shares a DM clip of shocking footage of migrants being put into James Madison High School in ...,13607,2440
Elon Musk सबके सामने शर्मिंदा हो गए,vs0MexWkRIQ,Elon Musk सबके सामने शर्मिंदा हो गए || @MrPlus123 #shorts #youtubeshorts #mrplus #fact #knowledge ...,217129,162
Elon Musk (Full Interview) | Real Time with Bill Maher (HBO),oO8w6XcXJUs,Elon Musk joins Bill for an exclusive Real Time interview.,101895,19417
"Elon Musk Opens Up in an Interview, Leaves The Audience Speechless",6Oa7y1nCN64,Elon Musk interview in Italy.,5308,1464
Elon Musk JUST Revealed What The US Government Is Trying To Hide,RV2mSMUCRzI,Become a Musk Fan today!   https://www.youtube.com/channel/UCXAWX5r69jcqPTNAhXCSA7Q/join Copyright or other ...,4812,28
Elon Musk warns as about AI💫🔥👌🏻,yJp5bEEO8uo,,15593,305
"HUGE UPDATE on Elon Musk&#39;s company talk: Starship IFT-3 plan, IFT-2 Fail Reason and Falcon 9...",I7JUwpIlSFw,"HUGE UPDATE on Elon Musk's company talk: Starship IFT-3 plan, IFT-2 Fail Reason and Falcon 9... === #greatspacex ...",1003,37
The Ugly Truth About Elon Musk,iXfafZo3H84,"Elon Musk, the genius billionaire supposedly trying to make the world a better place, might not be the man you think he is.",12769,4927
Elon Musk on Israel-Hamas war,W2myO-slp7w,Lex Fridman Podcast full episode: https://www.youtube.com/watch?v=JN3KPFbWCy8 Please support this podcast by checking out ...,32263,7811
Elon Musk Biographer on How the Tesla CEO Acts Behind Closed Doors | WSJ,cYBgE5C4HaY,"Elon Musk, leader of companies like Tesla, SpaceX and X, is one of the most influential and unpredictable CEOs in the world.",10028,1160
How Elon Musk caught a spy,LUQtHCsGJ4o,Elon Musk caught an employee spy leaking information in a genius way. Here's how... Source: ...,626473,3632
Elon Musk JUST CONFIRMED The Rapture Will Happen SOON!,gyyOqcxxlEg,Elon Musk JUST CONFIRMED The Rapture Will Happen SOON! Elon Musk is well-known for his knowledge in various fields.,135,12
Elon Musk: I disagree with the idea of unions,sctgA2qa-rA,Elon Musk sits down with Andrew Ross Sorkin at the 'New York TImes' DealBook Summit' on a wide-ranging interview including ...,12893,6873
"Elon Musk talks Twitter, Tesla and how his brain works — live at TED2022",cdZZpaB2kDM,"In this unedited conversation with head of TED Chris Anderson, Elon Musk — the head of Tesla, SpaceX, Neuralink and The ...",238700,18274
Elon Musk warns migrants are ‘coming for your homes’ after NYC kids forced out of classroom,HCsMcZCOL4o,Elon Musk said migrants “will come for your homes” in response to reports that New York City students were forced to work ...,2052,1787
David Goggins meets Elon Musk on Mars | The Big Red #shorts,0F4_bAio04E,Elon Musk ain't the first man on Mars #davidgoggins #elonmusk #shorts.,278446,2155
&#39;China WILL KILL US&#39; - Elon Musk LATEST Critical Warning,jLY0AlAa45A,Become a Musk Fan today!   https://www.youtube.com/channel/UCXAWX5r69jcqPTNAhXCSA7Q/join Copyright or other ...,1275,24
NEW: Elon Musk Leaves Audience Speechless in Italy,QnpPU1KjcIU,The Robots Are Coming https://www.farzadmesbahi.com/merch FREE One Year Supply of Vitamin d3+k2 and 5 AG1 Travel Packs ...,32472,6003
Elon Musk Is An Idiot (and so are Zuck and SBF),oVj4kZF-Fgk,"Tech CEOs aren't geniuses, and here's the proof. Subscribe to Factually: http://link.chtbl.com/factually Support me on Patreon: ...",219099,24965
The Story of Elon Musk,vai3Vh234EE,"Elon Musk is a business magnate, entrepreneur and engineer, who despite coming from humble beginnings in South Africa, ...",65481,4662
Joe Rogan Experience #1470 - Elon Musk,RcYjXbSJBN8,"Elon Musk is a business magnet, entrepreneur and engineer.",609939,92915
"Oh Sh*t, Elon Musk Just FLIPPED The Narrative!",XKwkKQJYkMI,At the New York Times' DealBook Summit Elon Musk slammed advertisers that have left X Support Me Directly HERE: ...,58050,6164
Watch Jordan Peterson’s Face as Sam Harris Attacks Elon Musk,6omwsUCoXoM,Dave Rubin of “The Rubin Report” shares a DM clip of Sam Harris trashing Elon Musk on Jordan Peterson's podcast. Watch Dave ...,5517,1875
Mr.Beast tacle Elon Musk !,c5_xnf8iqng,Petite passe d'armes entre l'un des plus gros youtubeur de la planète et l'un des hommes les plus riche de la planète. Mr Beast a ...,22357,113
"Elon Musk, Alex Jones, Andrew Tate in HEATED Debate!",BEW2aYQlXo4,Link to full X space: https://twitter.com/i/spaces/1lPKqbPkeLdGb?s=20 The Robots Are Coming ...,43261,11672
Most Controversial Elon Musk Interview (Seriously Heated - Must Watch) | Timestamps Included,zlgBcyfybWI,0:00 Intro 0:16 Elon on his latest controversy 2:30 Elon gets emotional 3:10 Don't advertise on X (Twitter) 4:20 GFY 4:40 Avertisers ...,16741,5408
Elon Musk&#39;s BRUTALLY Honest Interview With Tucker Carlson (2023),zaB_20bkoA4,"Elon Musk's BRUTALLY Honest Interview With Tucker Carlson | In this interview, Tucker Carlson engages in a thought-provoking ...",85692,11304
Mmm...,O2jlC07cOh0,usk. Instagram: https://www.instagram.com/deepvoid_ ---------- Music: Kirby's Dream Land 3 - King Dedede.,947294,18015
&#39;You Just Lied&#39;: Elon Musk Slaughters BBC Reporter In Live Interview,XqJKAnN0-gM,Elon Musk slaughtered BBC reporter James Clayton in a live interview.,380338,70589
Elon Musk Answered Our DM,iVXYUVkF56U,Join this channel to get access to perks: https://www.youtube.com/channel/UCf7k_CRPu1ufFYXBCPHEt4g/join.,864032,11941
Why Elon Musk&#39;s oldest son disappeared #shorts,9jCetboIF5k,,391005,25030
Joe Rogan Experience #1169 - Elon Musk,ycPr5-27vSI,"Elon Musk is a business magnet, investor and engineer.",1059838,139498
Der reichste Mann der Welt,h-TaQEFTQYw,Probiert Honkai: Star Rail unter diesem Link aus: https://hoyo.link/e3qMDUAd Code für 50x Stellare Jade: 8B64E57RPP3P ...,170083,6989
The Trillionaire Life Of Elon Musk,I9YNa5sy1Po,Become a Musk Fan today!   https://www.youtube.com/channel/UCXAWX5r69jcqPTNAhXCSA7Q/join Copyright or other ...,1114,38
Elon Musk&#39;s X Just Got DELETED From The App Store,8iyl6Bh49SY,Become a Musk Fan today!   https://www.youtube.com/channel/UCXAWX5r69jcqPTNAhXCSA7Q/join Copyright or other ...,673,26
Jeff Bezos on Elon Musk | Lex Fridman Podcast Clips,anyN8lj51Ds,Lex Fridman Podcast full episode: https://www.youtube.com/watch?v=DcWqzZ3I2cY Please support this podcast by checking out ...,7501,972
Joe Rogan and Elon Musk order pizza..🍕😂#joerogan #elonmusk #podcast,Bba5gwx2SAE,"In this hilarious clip, Joe Rogan and Elon Musk order pizza.. and things get a little crazy! You don't want to miss this hilarious clip ...",113135,2507
Elon Musk - I Don&#39;t Ever Give Up,iJhjtiFuun8,Get Our New 'Billionaire Mindset' eBook + Tons Of FREE Bonuses   https://lenidymindset.com ********** The Best Books to build ...,1021701,7566
The Cult of Elon Musk | A Billion Dollar Disaster,LAU1l7iEpoU,Download the FREE Upside App at https://upside.app.link/JAUBREY to get $5 or more cash back on your first purchase of $10 or ...,82455,10235
कैसे दुनियां के सबसे बड़े कंगाल बने Elon Musk😲| A2 Motivation |,ESixuA06gvA,"The bad days of Tesla CEO Elon Musk, once known as the richest man in the world, do not seem to end. The speed with which his ...",205497,1683
I DON&#39;T EVER GIVE UP - Elon Musk Gangsta Paradise | Motivational Video #shorts,wO9acRaz11w,Elon Musk Gangsta Paradise short Motivational Video. Elon Musk emotional interview which bring him to tears. Elon Musk ...,742156,7137
Success Doesn&#39;t Come To 😈😱🔥 Elon Musk Status ✨🔥#sigmarule #motivation #billionaire #elonmusk #shorts,xyadDrT7JIc,Success Doesn't Come To Elon Musk Status ✨  #sigmarule #motivation #billionaire #elonmusk #shorts #shorts ...,27065,157
Elon Musk Accidentally Leaked Terrifying Details On LIVE TV,8fOODpiJ2kg,"Elon Musk Accidentally Leaked Terrifying Details On LIVE TV We transform the original content from shows, podcasts, and ...",1061,328
Why I Hate Elon Musk,Dkix4UzEbjU,Free weekly essays written by Moon - https://mailchi.mp/3ded12821743/moon This the truth behind how Elon Musk made so ...,116361,18019
Jeff Bezos on Elon Musk | Lex Fridman Podcast Clips,anyN8lj51Ds,Lex Fridman Podcast full episode: https://www.youtube.com/watch?v=DcWqzZ3I2cY Please support this podcast by checking out ...,7501,972
Elon Musk roasts Green Day after their anti-MAGA lyric change in “American Idiot”,ABm3KOrW8tM,,23122,3085
Elon Musk&#39;s drug use worries leaders at Tesla and SpaceX,vrbA5gDeuy0,CNBC's Joe Kernen reports on the latest news.,268,416
Como Elon Musk se tornou uma das pessoas mais ricas do mundo?,EJ6emudoc2M,Elon Musk é um dos donos da SpaceX e da Tesla. Mas você sabe como foi que ele se tornou um dos homens mais ricos do ...,135467,4116
The Man Who Followed Elon Musk Everywhere: Here Are 7 Elon Musk Secrets! Walter Isaacson,9BDmC5u_MLE,"If you enjoy hearing about industry changing innovation, I recommend you check out my conversation with Airbnb founder, Brian ...",27834,2079
Elon Musk Gets Emotional Over Poverty,L1zrX66eLl0,Subscribe to my channel. #shorts Follow the Instagram: https://www.instagram.com/declanltd/ This content doesn't belong to ...,327571,11158
A Day In The Life of Elon Musk,n8pIEtiLMpU,A Day In The Life of Elon Musk.,1753,149
Elon Musk and Joe Rogan start again on Mars | The Big Red,OZshCpFSgwI,Watch Part 2 here -- https://www.youtube.com/watch?v=fyjs0zpS4xo& The Earth has been destroyed and Elon Musk has escaped ...,36813,1518
Liberals FUME Over Don Lemon GROVELING To Elon Musk To Save Career As FIRED Medhi Hasan QUITS MSNBC!,xPTV6dohu4A,Merch: https://gforemanbcp.com/ Patreon: https://www.patreon.com/blackconservativeperspective Paypal: ...,8236,960
Elon Musk Shocks the Internet by Agreeing with John Fetterman About This,LVk11RG9b2Q,Dave Rubin of “The Rubin Report” talks to Ari David and Emily Austin about Elon Musk shocking his fans by agreeing with John ...,2532,386
DDG - Elon Musk ft. Gunna (Official Music Video),fW43Pdw3F00,"DDG - Elon Musk ft. Gunna (Official Music Video) ""Elon Musk"" available at: https://DDG.lnk.to/ElonMusk Directed by: Stripmall ...",350550,113424
School Teaches Us 💯🔥😎 #shorts #elonmusk #billionaire #motivation #quotes #sigmarule #attitudestatus,ZvTHFYyrsyc,School Teaches Us #shorts #elonmusk @tsmotivationhacks #tsmotivationhacks #shorts #elonmusk #billionaire ...,N/A,1832
&quot;NO COMPETITION&quot; 〉〉 Elon Musk Edit | Hensonn - Sahara,AXNvRVAoe8U,No Competition Elon Musk edit #elonmusk #elonmuskmotivation #elon #edit #finance #money #success #business #billionaire ...,4159,89
Working for Elon Musk: Ex-Employees Reveal His Management Strategy | WSJ,JEikQP8-es0,"He has never said this, but I've watched it. You have 30 seconds to make your point.” What Elon Musk has been doing at Twitter ...",23134,4427
Elon Musk vive como POBRE ! #elonmusk,EVmdTNkuu1g,Para parcerias: contatocontosmotivacionais@gmail.com Instagram: https://www.instagram.com/contosmotivacionaisofc/ #shorts ...,649173,5352
"Elon Musk:&quot;El método que me permitió SER RICO en poco tiempo&quot; ¡Cuando descubras esto, todo cambiará!",M54YmG1ST7o,"Elon Musk: ""El método que me permitió SER RICO en poco tiempo"" ¡Cuando descubras esto, todo cambiará! - Resumen ...",8290,224
Elon Musk Makes Joe Rogan Go Silent with His Chilling Warning,eff_N61jyws,Dave Rubin of “The Rubin Report” shares a DM clip of Elon Musk telling Joe Rogan why he bought Twitter after what he saw in ...,9646,604
"Elon Musk Reveals His Knowledge on Aliens, Challenges Putin to UFC, and Predicts WW3",fXS_gkWAIs0,TRY HAPPY DAD (21+ Only): http://happydad.com Full Send & Nelk Store: http://fullsend.com PODCAST on YouTube: ...,281919,32324
Elon Musk vs Economía de Paises 💵,py3l2plR_GU,Que paises se puede comprar Elon Musk con su patrimonio? En este video te lo cuento Contacto y promoción: ...,629905,5301
EVANGELISTA GARY LEE -‼️HOMBRE MÁS RICO DEL MUNDO‼️ ¿ELON MUSK CREE EN EL RAPTO?,0z9pmSYUmNg,"Si éste ministerio te ha sido de bendición , en el encabezado, haz click en ""HACER DONACIÓN "" y ahí puedes enviar una ...",1333,N/A
Elon Musk सबके सामने शर्मिंदा हो गए,vs0MexWkRIQ,Elon Musk सबके सामने शर्मिंदा हो गए || @MrPlus123 #shorts #youtubeshorts #mrplus #fact #knowledge ...,217130,162
A HISTÓRIA DE ELON MUSK. #tesla #negócios #elonmusk #spacex #empreendedorismo #shorts,qIX6jv8NZ-s,"Elon musk criou ou ajudou a crescer as seguintes empresas: SpaceX; Neuralink; PayPal; Tesla, Inc.; SolarCity; e, recentemente, ...",27491,469
Elon Musk smokes a blunt on Joe Rogan&#39;s podcast😳 #shorts,CgKcXbmkNj4,"shorts #elonmusk SUBSCRIBE for your daily dose of Elon: https://bit.ly/3PkvdMl Elon Musk, Trillionaire, Tesla, SpaceX, Dogecoin, ...",101016,1188
Dirty Secret Behind Elon Musk&#39;s Money,JsTGSwD70k0,Newest Subscriber ⭐️ isztech ⭐️ *** Elon's finances were just exposed in front of the entire world. Leaked documents have ...,232054,1749
"Elon Musk: “Before His Death, This Soviet Astronaut Reveals A TERRIFYING Secret”",ngMyMvtYySM,Become a Musk Fan today!   https://www.youtube.com/channel/UCXAWX5r69jcqPTNAhXCSA7Q/join Copyright or other ...,1057,8
Jordan Peterson Reacts To Elon Musk - “My Mind Is A Storm”,83xLPeUaS6Q,Get a 20% discount & free shipping on your Lawnmower 5.0 at https://manscaped.com/wisdom (use code MODERNWISDOM) ...,22200,1489
"Elon Musk Drone Dance Behind the Scenes at Teslas Delivery Event 2022, Berlin Germany in 4K",rpIuoxMSFeQ,Drone Team: https://www.skynamic.net/ Follow us for more drone action on Instagram: https://instagram.com/Skynamicdrone Pilot: ...,112855,2925
"Elon Musk delivers SpaceX update, talks Starship progress and more!",6xLmBLWDSHo,SpaceX's Elon Musk talks about the state of the private spaceflight company during a recent address at Starbase in Texas.,931,82
Elon Musk vs Mark Zuckerberg,bnZ81bgjW1M,Elon Musk VS Mark Zuckerberg Cage Fight #shorts #factsmine #trending #viral #new #latest #knowledge #interesting #fight.,307360,2927
Elon Musk JUST EXPOSED Joe Bidens CORRUPTION!,Td0JTt_eqKE,LIMITED-TIME: Free eBook on the Hunter Biden SCANDAL Grab your copy here ➡ https://bit.ly/47Q6B6M ...,752,77
"Tesla CEO Elon Musk: I&#39;ll say what I want to say, and if we lose money, so be it",6sUwRiIncKU,"Tesla and Twitter CEO Elon Musk sits down with CNBC's David Faber for an exclusive interview from Austin, Texas, during Tesla's ...",21365,7335
It Will Give You Goosebumps | Elon Musk (Motivational Video),Zf87y5bWzUA,https://bit.ly/MotivationMadness_Mindset Download Mindset for a study boost! Crush your goals with motivating speeches and ...,39438,2667
"Elon Musk Calls Out ILLEGAL IMMIGRATION Replacing US Births, Media Calls it Great Replacement Theory",A0Gm1akc_8Y,BUY CAST BREW COFFEE TO FIGHT BACK - https://castbrew.com/ Become a Member For Uncensored Videos ...,5943,906
The FCC just ambushed Elon Musk’s Starlink service,wgfQaMoeeKc,FCC Commissioner Brendan Carr details denying support for Elon Musk's Starlink and the rise of antisemitism on social media ...,20341,8983
The evolution of Elon Musk 🗿#shorts #viral #memes,ZgoykTKqPBs,viral #elonmusk #trending This is Elon Musk.,1816967,12595
Elon Musk: &quot;La pobreza no es un accidente&quot; ¡Lo que la gente exitosa sacrifica para obtener RIQUEZA!,Cs79PCmiwJ0,"Elon Musk: ""La pobreza no es un accidente"" ¡Lo que la gente exitosa sacrifica para obtener RIQUEZA! - Resumen ...",16912,267
The Evolution of Elon Musk💵💵#shorts,9qAuq9zN_5c,"The evolution of Elon Musk and his money. In this video, Elon Musk's wealth is really put on display, and the viewer can see just ...",238761,1624
"Elon Musk: SpaceX, Mars, Tesla Autopilot, Self-Driving, Robotics, and AI | Lex Fridman Podcast #252",DxREm3s1scA,"Elon Musk is CEO of SpaceX, Tesla, Neuralink, and The Boring Company. To support this podcast by checking out our sponsors: ...",181531,16662
Getting Fired From Tesla by Elon Musk,whQM1ozV9nY,Full Vid: https://tinyurl.com/bdz7j5ex Check out the Patreon! https://www.patreon.com/icedcoffeehour Add us on Instagram: ...,765501,5979
Elon Musk ROASTS Joe Biden 🤣,3KgGuOYUylE,SUBSCRIBE TO THE PODCAST https://link.chtbl.com/hDPO8U2P Sign up for The Benny Newsletter: ...,122017,7133
This is Elon Musk 🧠. IQ 999+,pkJ0hw05qww,,5015951,48956
This is Elon Musk his daily routine 💼 #shorts,LqEsbAnfOCA,"Elon Musk his daily routine #shorts #elonmusk SUBSCRIBE for your daily dose of Elon: https://bit.ly/3PkvdMl Elon Musk, ...",9710,155
FOI ASSIM QUE ELON MUSK MUDOU O MUNDO! #shorts,ucwgyVliTzw,Agora sou candidato a DEPUTADO FEDERAL! VOTE 4488 #Vote4488 Estamos começando mais uma semana. Temos 7 ...,63936,1574
Stop Wasting Time 😠🔥 Elon Musk Status 🔥 #motivation #billionaire #sigmarule #elonmusk #shorts,y7UiBmGR-pI,,16968,109
Elon Musk Just Revealed The Terrifying Truth Behind Antartica,HpCTtJo9Gh0,"In the vast, frozen expanse of the southernmost continent lies a secret that has remained hidden for centuries. A secret so ...",4184,401
I Spent 24 Hours in Elon Musk’s House,_aqJB9t4VeE,"For 60% off with HelloFresh PLUS free shipping, use code UNSPEAKABLE60 at https://bit.ly/3EbkJLf! #sponsored NEW MERCH!",54497,4795
"Elon Musk REVELOU algo chocante sobre o Arrebatamento, a Volta de JESUS e o Rio Eufrates...",l2bVjtZqeaA,PODE ESTAR MAIS PERTO DO QUE IMAGINAMOS... Elon Musk Revela Segredo Chocante em que ele acredita sobre o ...,6826,403
"This is the dangerous AI that got Sam Altman fired. Elon Musk, Ilya Sutskever.",cXemEDZA_Ms,"AI robots, Sam Altman and Elon Musk. Visit https://brilliant.org/digitalengine to learn more about AI. You'll also find loads of fun ...",20245,2781
Elon Musk Disney&#39;e büyük ayar verdi!,2WQpUucfh6A,Elon Musk ve Disney büyük haber oldu. İlginç bilgilerin olduğu güncel haber videosu oldu.,122641,1191
"Elon Musk&#39;s &quot;$10,000 Home&quot; Is A Complete Lie",7UTJuWP8_2Q,Go to https://athleticgreens.com/adamsomething to get started on your first purchase and receive a FREE 1-year supply of Vitamin ...,66756,4268
Elon Musk and NELK Kyle Forgeard Discuss the Genuis of Milad Mirg&#39;s Subway Videos,KLjlZAO4YOg,elonmusk #elon #elonmuskmotivation #NELK #kyleforgeard #milad #subway #podcast.,306,9
Elon Musk: A future worth getting excited about | Tesla Texas Gigafactory interview | TED,YRvf00NooN8,"What's on Elon Musk's mind? In this exclusive conversation with head of TED Chris Anderson, Musk details how the radical new ...",166955,13935
Don Lemon joins Tucker Carlson in Support of Elon Musk&#39;s Bold New Move,6hKELu1sY_I,"Sign up for @SiriusXM and listen to the whole Karen Hunter Show, M-F, 3-6 p.m. ET: https://siriusxm.us/KarenHunterSXM Like, ...",534,80
ACUSAN A ELON MUSK DE ALGO MUY FUERTE,_6SVvq7bSgg,"Canal dedicado a los Enigmas, la Ufología, y los misterios del universo. EL ORÁCULO DE RIMBEL: ...",8447,737
What Elon Musk Teaches at His Schools,h8XDVG1gWrs,Why is Elon Musk Starting Schools? So Elon's just confused everyone. He's put aside $100 million dollars to start a primary and ...,1062,25
A Rotina de Elon Musk,APu-B0BJfMc,Shorts.,311942,1745
DDG - Elon Musk ft. Gunna (Official Audio),Un2gSPpjqFo,"DDG ft. Gunna - Elon Musk (Official Audio) ""Elon Musk"" available at: https://DDG.lnk.to/ElonMusk Follow DDG: ...",127449,10535
What inspires you? Comment below! | Elon musk motivation | #shorts #elonmusk #tesla #spacex,hCJ2_4wjE88,"Hey, Jaspal here I will keep uploading such short videos related to education, Entrepreneurship, and life! So my friends subscribe ...",30278,422
Elon Musk&#39;s Sinister Silencing Attempt BACKFIRES Spectacularly,h36oBVoUDQg,Elon Musk faces immediate criticism after notable left-leaning journalists and top critics of Musk had their accounts suspended ...,3019,670
Elon Musk veut mettre des puces dans les humains ! 🤖 #elonmusk #shortsvideo #ordinateur #technology,lifcrLOdazc,SALUT !! Je pose ça la : #shorts #actualité Si tu veux me voir + que en scrollant par hasard abonne toi Et si t'es pas souvent sur ...,106778,2204
"Elon Musk on Abundance, AGI, and The Media in 2024 | EP #79 (X Spaces)",_PcL4w--uNs,"In this episode, Peter and Elon hop on X Spaces to discuss Data-driven optimism, solving grand challenges, uplifting humanity, ...",2992,392
Elon Musk and Mark Cuban DUEL Over &#39;WOKE&#39; Company Diversity Policies as D-E-I is on D-E-CLINE,w4WcJ028LQE,Executive Director of Consumers' Research Will Hild weighs in on ESG. #ESG #DEI #Lululemon About Rising: Rising is a ...,915,435
Elon Musk&#39;s Work Ethics Will Give You Goosebumps,2H4z1g-eHyU,Elon Musk: Quest for a Fantastic Future: https://amzn.to/3VoVSLj (New York Times and International Bestseller More than 1.5 ...,30147,2166
&quot;Whitest Team in the NBA&quot; - Elon Musk Exposes Mark Cuban&#39;s DEI Hypocrisy,ebrrzDceibs,"Patrick Bet-David, Adam Sosnick, and Vincent Oshana discuss Elon Musk Exposing Mark Cuban's DEI hypocrisy. Connect ...",7616,1747
NEW: Elon Musk Mind-Blowing Predictions for the Future,68cKroVKnA0,The Robots Are Coming https://www.farzadmesbahi.com/merch FREE One Year Supply of Vitamin d3+k2 and 5 AG1 Travel Packs ...,3860,547
Elon Musk receives the mom treatment from Kris Jenner at the Met Gala,G6ZzsdRGo0o,,N/A,2081
ලොව ධනවත්ම පුද්ගලයාගේ කතාව - Elon Musk&#39;s Life story - Sinhala Motivational Video From Bio Api - 🔥💪,C4F-Do1ipGc,"Elon Musk's Life story - Sinhala Motivational Video From Bio Api Elon Reeve Musk FRS is a business magnate, investor, and ...",13847,648
Elon Musk FINALLY Revealed What The US Government Has Been Hiding,-hRGvy_mcJQ,"Here, at the ""Elon Musk Confidential"" channel, we transform the original content from shows, podcasts, and key-notes with Mr.",273,0
ELON MUSK É TÃO RICO QUE...,AdZTq0u2aP0,,375026,4089
Elon Musk’s Secret Time Management Trick! | Best Time Management Motivation! #tipsandtricks,982ZfBh_Pe0,Elon Musk's Secret Time Management Trick! | Best Time Management Motivation | Motivation QuoteShala | QuoteWale Bhaiya ...,54232,194
Elon Musk Explains NeuraLink,OKB1PuclFEo,Watch the Real Talk with Zuby Podcast Ep. 263 with Elon Musk here: https://www.youtube.com/watch?v=pjc_oo4ApSY Follow ...,20305,3851
What Elon Musk said about Jesus Christ will blow your mind!,e0H_fXxVn8k,"Probably the most famous influential man at the moment, Elon Musk agrees with Jesus word and says, “I always wanted to be ...",103231,0
MrBeast rejects Elon Musk: I won&#39;t post on X,wuvBkaXjfTI,Amra & Elma LLC founder Elma Beganovich reacts to social media influencer MrBeast rejecting Elon's Musk's invitation to post on ...,434,563
ELON MUSK NET WORTH ~ WhatsApp Status #shorts Billionaire Attitude Status #motivation #quotes,FrOFkX3hWCI,"Hey, Billionaire Inspire here I will help you to stay motivate. If you like this video do not forget to subscribe this channel! #shorts ...",529456,3353
Third Row Tesla Podcast – Episode 7 - Elon Musk&#39;s Story - Director&#39;s Cut,J9oEc0wCQDE,"Welcome Back to our Third Row Tesla Podcast! We worked very hard to bring you Part 1 and 2 of Elon's Story, as he told it to us.",29270,3648
The hardest choice Elon Musk has ever faced,owaF4MDga-w,Elon Musk talks about Aliens - https://youtu.be/uPdNtAlaF4g Subscribe and get a boost of motivation every day On this channel ...,870107,8424
Elon Musk Tricks Mark Cuban to Accidentally Own Himself In DEI Fight,IwcKn_dxkyQ,Dave Rubin of “The Rubin Report” shares a DM clip of Elon Musk escalating his war with Mark Cuban over the danger of DEI ...,11122,1958
I Saw Elon Musk Driving a Cyber Truck!! #Shorts,vrs5mx8Z3W4,,912752,6028
Filhos de Elon Musk FINALMENTE revelam o que acham DELE 😱 #shorts #elonmusk,62kww4nHJPM,Filhos de Elon Musk FINALMENTE revelam o que acham DELE Para crédito ou pedido de remoção entre em contato por e-mail.,334687,1438
