title,video_id,description,like_count,comment_count
"Als Laschet Elon Musk nach Zukunft des Autos fragt, hat der nur Häme übrig",BtaGEhs5Nzg,Beim Besuch von Armin Laschet auf der Baustelle der Gigafactory von Tesla war Konzernchef Musk sichtlich gut gelaunt. Sowohl ...,2156,828
Elon Musk On Taking Mushrooms!,aihc45a-fRQ,FULL EPISODE: https://youtu.be/fXS_gkWAIs0 WATCH MORE PODCAST CLIPS: https://podcastnetwork.co/playlist Instagram: ...,12417,2943
Elon Musk Explains How he Could Fix Planes | JRE #jre #tesla #elonmusk,EDg4zVVn8v4,,1670,59
एलोन मस्क - एक प्रेरणादायक जीवनी -  ELON MUSK - AN INSPIRATIONAL BIOGRAPHY - WAVE HINDI DOCUMENTARY,48V4nfGQUKw,एलोन मस्क की अद्भुत कहानी और एक युवा उद्यमी से हमारे समय के सबसे सफल ...,4920,124
Perjuangan Dan Harga Sebuah Kesuksesan Bagi Elon Musk - Subtitle Indonesia - Motivasi Kerja,pzDnh-oI1rI,"Elon Reeve Musk FRS adalah tokoh bisnis, penemu, dan industrialis dari Amerika Serikat. Ia merupakan pendiri, CTO, dan CEO ...",7524,505
Így veri át az egész világot Elon Musk,MC06kkbW0yA,Csatlakozz te is a csatorna tagjaihoz https://www.youtube.com/c/tizeslista/join Rajongói számára Elon Musk egyet jelent a ...,4874,1060
Elon Musk - People Don&#39;t Realize the Mistake of The Moon Landing,1faBDMiDL1s,"Elon Musk's opens up about about his observations whether moon landing was fake or real. As Elon Musk explains, Apollo ...",1328,1343
Grimes Reveals How Amber Heard Seduced Elon Musk,FhhAYsLXDNE,"Grimes Reveals How Amber Heard Seduced Elon Musk In light of the Amber Heard Vs. Johnny Depp case, Elon Musk has found ...",5834,1658
Elon Musk Explains How Top Gear FAKED Tesla Breakdown In 2011😔 ( via @joerogan ) #shorts #elonmusk,0OLLI70_kDQ,The Joe Rogan Experience 1609 w/ Elon Musk: ...,432642,5612
Elon Musk JUST UNVEILED Insane NEW Hypersonic Aircraft Which Outperfoms US Fighter Jets!,i_reHlBvOSg,Elon Musk JUST UNVEILED Insane NEW Hypersonic Aircraft Which Outperfoms US Fighter Jets! Imagine a hypersonic aircraft ...,312,20
Elon Musk - Space X Interstellar score  (HANS ZIMMER),wQIb5TA-5dQ,"This video is for entertainment propose only, I dont own any of these videos. this project was only for expanding my skill on Final ...",50162,2913
The Elon Musk Story - 3D Animated,8Hoe9by0wNc,"This is a 3D animation of an inspiring story of a man called Elon Musk. Enjoy watching! MUSIC Mark Petrie, Andrew Prahlow ...",337193,13798
"Major investor shuts down Elon Musk drug-use claims: He’s ‘serious, focused’ #shorts",_DVaxWYO1nk,"ARK Invest's Cathie Wood came to Elon Musk's defense, denying any accusations of drug use by one of the most 'serious and ...",987,99
Elon Musk tells Tesla employees that remote work is no longer acceptable,AiRfGDWrBDI,shorts #ElonMusk #Tesla #ElonMuskreturntowork Yahoo Finance Senior Reporter Pras Subramanian talks about Elon Musk's ...,5360,777
"Elon Musk Arrives For Lunch With Heavy Security At Tullio Restaurant in Rome, Italy",FKd-SaHuT_o,"ElonMusk Arrives For Lunch With Heavy Security At Tullio Restaurant in Rome, Italy 6.16.2023 - TheHollywoodFix.net [Video ...",712,108
Tesla Optimus - Elon Musk&#39;s NEW Humanoid Robot Revealed!,vL24MCHo4T4,Tesla Optimus - Elon Musk's NEW Humanoid Robot Revealed! Keep Your Digital Life Private and Be Safe Online: ...,136,20
Elon Musk Holds Back the Tears,2iwdZPpU2Q8,You don't have to be weak to cry. ☀︎ Savanteum is on a mission to inspire the next generation of creators and innovators: Video ...,197224,6529
Finally: Germany &amp; Elon Musk  Reveal Their New Powerful Tank,LDe7OGpPodM,Finally: Germany & Elon Musk Reveal Their New Powerful Tank. It seems without doubt that Elon Musk is a true revolutionizer!,59812,6396
"IT HAPPENED! Elon Musk Went Public With $15,000 Tesla Home",5iXUnAGvRjc,Become a Musk Fan today!   https://www.youtube.com/channel/UCXAWX5r69jcqPTNAhXCSA7Q/join Subscribe with all ...,25029,14
वर्तमान पुस्ताकाे सुपर हिराे || Elon Musk Biography || all history,MgUVhf-IFuM,फिल्मी कथा: https://youtu.be/Q2esMFX1YxU Follow on Facebook: https://www.facebook.com/bishwoghatna/ Follow on ...,19954,415
Elon Musk ujawnia straszną prawdę o Biblii i Jezusie!,_HmdUh05iVg,Co jeden z najbardziej utytułowanych ludzi na ziemi wie o Biblii i Jezusie Chrystusie? Czy kiedykolwiek się nad tym ...,4118,1341
Elon Musk on living with Asperger&#39;s syndrome,hzlbYvw-5gk,This is a channel dedicated to spreading Elon Musk's values and news. We don't want world to hate anyone. Spread love and get ...,5005,350
You Don&#39;t Need a College Degree! - Elon Musk,xSDmA7rjNgE,Elon Musk on why you don't necessarily need a college degree to do great things. ______ Subscribe my channel. ♚ From 0-1M ...,507811,7384
I don&#39;t even Own a Home - Elon Musk,Vi0on4z7j1Y,ElonMusk #YTShorts #spaceX #Tesla #TEDTalks Social links Facebook ...,103657,3131
Elon Musk slams DEI hiring at Boeing &amp; United Airlines,qdJLUH95CHA,There's a new controversy involving Elon Musk. Some claim the businessman is backing racist beliefs about Black pilots.,46,164
Elon Musk: &quot;La pobreza no es un accidente&quot; ¡Lo que la gente exitosa sacrifica para obtener RIQUEZA!,Cs79PCmiwJ0,"Elon Musk: ""La pobreza no es un accidente"" ¡Lo que la gente exitosa sacrifica para obtener RIQUEZA! - Resumen ...",16912,267
Elon Musk apresenta novos detalhes do seu Robô Humanoide | Robôs de segurança aumentam nos EUA,PGDizlVUdjM,"Elon Musk revelou a atualização do seu robô humanoide para habitar nossos lares, o Optimus Tesla Gen 2 apareceu com novos ...",8941,402
Elon Musk Embat Semua Istri Orang ?!,_6RCHSw9S-4,Menurut kalian siapa yang bener di case ini? #shorts #raymondchin #elonmusk #sergeybrin Kalo kalian mau belajar tentang ...,34755,420
I was almost killed by a truck | Elon Musk,W2VHlXI5hPw,Elon Musk talks about Aliens - https://youtu.be/uPdNtAlaF4g Subscribe and get a boost of motivation every day On this channel ...,2545698,10034
President Biden questioned on Elon Musk&#39;s Twitter acquisition,20fD9OKVtdw,"shorts #yahoofinance President Biden chose his words carefully on Nov 9, 2022 after being asked whether Elon Musk should be ...",33820,8177
Elon Musk - Thoughts On The Metaverse,s_5C80Oh36M,Elon Musk's views on the Metaverse and whether we should take it seriously at this point. What do you think? . . . . . . . . If you're ...,28975,1161
เปิดประวัติ Elon Musk: จากเด็กที่โดนบูลลี่ สู่อัจฉริยะผู้ถูกขนานนามว่า Tony Stark ในชีวิตจริง,FJQ9u-C6cfs,หากคุณเป็นที่สนใจในด้านเทคโนโลยี เรื่องของห้วงอวกาศ หรือแม้แต่คนที่กำลังเล่น Bitcoin อยู่ คงไม่มีใครไม่รู้จักชายที่ชื่อ Elon Musk ...,6117,135
What is Elon Musk&#39;s Starlink Project?,8QzLC-krz3w,Link to Main Channel: https://www.youtube.com/dhruvrathee #shorts.,144215,425
Elon Musk: curiosidades que seguramente desconocía del millonario,vhD_3T3nNMg,Cómo pasó un niño sudafricano de ser acosado en la escuela a ser un empresario de fama mundial? La historia de Elon Musk ...,4587,406
Talking Tech with Elon Musk!,MevKTPN4ozw,"Talking Tesla, tech and the future with Elon Musk. MKBHD Merch: http://shop.MKBHD.com Video Gear I use: ...",560951,27721
"ASSIM VIVE ELON MUSK, O HOMEM MAIS RICO DE TODOS OS TEMPOS",Fr_xByVrPAU,"Além de ser o homem que possui a maior fortuna do mundo, Elon Musk é um cara excêntrico, que foge completamente dos ...",106016,2688
Elon Musk all Hollywood Cameos | Young Sheldon | The Big Bang Theory | Iron Man | SpaceX,Fbc3iF9DxcE,"This videos features all the cameos of Elon Musk in Hollywood. In Young Sheldon, Big Bang Theory, Iron Man and many more.",20402,733
TE PONDRÁ LA PIEL DE GALLINA - Elon Musk discurso motivacional 2023,Pu52Q9lpPN0,"Elon Musk, fundador y consejero delegado de SpaceX, consejero delegado de Tesla y el hombre vivo más rico, pronuncia uno ...",16157,580
It happened!Elon Musk just reacted to ULA Vulcan launch while NASA&#39;s in BIG TROUBLE...,7vjukrsOfz4,It happened!Elon Musk just reacted to ULA Vulcan launch while NASA's in BIG TROUBLE... === #elonmusk #vulcans #starship ...,1818,285
TESLA CYBERTRUCK STUCK IN SNOW…WHERE IS ELON 😳 #tesla #cybertruck #ev #elonmusk #cars #carshorts,TrVLc8tWfGI,,224,84
👽 ELON MUSK’S TERRIFYING ALIEN PREDICTION!,TqWbMZIQAoo,ELON MUSK'S “FRIGHTENING” ALIEN PREDICTION! #shorts SUBSCRIBE: ...,818,44
Elon Musk Was Murdered in Among Us,Wd7WGEuhUm8,We try and figure out who killed Elon Musk in Among Us ☞ Subscribe & click the bell Subscribe ...,54012,1881
Elon Musk Gives &quot;Cringeworthy&quot; Speech Allegedly Under the Influence of Drugs at SpaceX (2017),Fh9OgLsJRD8,"Released to the public by SpaceX via Twitter on January 11, 2024 (https://twitter.com/SpaceX/status/1744581130727391488) ...",28,43
Elon Musk völlig verwirrt bei SpaceX-Präsentation,dsxCxABCcbY,Besuche auch unsere anderen Kanäle: ***Mehr Videos: www.oe24.at/video +++Facebook: facebook.com/oe24.at/ ---Instagram: ...,32,56
"Elon and Grimes, what a weird couple 🤣 #shorts #elonmusk #grimes",oh_apRH8rp8,elonmusk #grimes #snl #funny.,2302,222
Elon Musk Best Moments - Epic Montage,S8UIXC7O6dQ,Subscribe for more Elon Musk ! Watch more Elon ...,567,38
Why Elon Musk is not a fan of Warren Buffett,3al1Sx0GHGo,You can NOW Become a member of our channel to support us!,45413,1738
Elon Musk 2008 SpaceX Presentation to The Hollywood Hill (PART 1),ZuKUOBvIKE4,"On December 6, 2008, for The Hollywood Hill's holiday party (www.hhill.org) at the home of Victoria & Dennis Hopper, we hosted ...",3507,519
Elon Musk -  Sonhos Sem Limites [CEO Tesla e SpaceX Legendado Português Entrevista],vac0ucGGYxk,"Este vídeo mostra a ambição do bilionário Elon Musk. Ele é dono de quatro empresas. A Tesla, que é a melhor fabricante de ...",16419,273
Elon Musk ve Cumhurbaşkanı Erdoğan&#39;ın samimi anları! #elonmusk #shorts #erdoğan #twitter #qatar2022,FpbE6LRqz8M,"Cumhurbaşkanı Erdoğan, Katar'daki dünya kupası finalinde teknoloji ikonu Elon Musk ile görüştü. Kısa süren sohbette Twitter ...",11289,964
Elon Musk Sia Unstoppable BGM,HA1h3oY97qA,shorts Elon Musk Sia Unstoppable BGM music - Sia Unstoppable.,1041798,3791
Elon Musk responds To Smoking Pot,WfwnTXJ-BaY,Subscribe to my channel. #shorts Follow the Instagram: https://www.instagram.com/declanltd/ This content doesn't belong to ...,1312554,14878
La ONU responde a ELON MUSK con su PLAN para acabar con el HAMBRE en el MUNDO| Ac2ality,RnzPfHjoCyE,"La ONU ha respondido a ELON MUSK. David Beasley, el director del programa alimentario de la ONU, ha tuiteado un enlace a ...",309576,17172
"&quot;Se non lo capiamo ora, SARÀ TROPPO TARDI!&quot; - Elon musk",IGXqntUUL4U,"Speriamo che questo video vi sia piaciuto, investiamo tempo e denaro nella creazione di questi contenuti, grazie a tutti per il ...",7844,1464
Elon Musk dismisses claims drug use is causing alarm at Tesla and Space X,31meFW5hp1s,Keep up to date with the latest news at https://www.gbnews.com Join us today and unlock your members-only benefits: ...,66,44
Elon Musk: The billionaire CEO who never gives up! #inspiring #shorts,qCfh8cRExp4,Elon Musk talks about why you should NEVER give up and NEVER listen to people who tell you to stop dreaming!! #inspirational ...,24393,1518
Shallipopi Elon musk [lyrics video],ZEF711FnT40,,505,23
"&quot;Se non lo capiamo ora, SARÀ TROPPO TARDI!&quot; - Elon musk",IGXqntUUL4U,"Speriamo che questo video vi sia piaciuto, investiamo tempo e denaro nella creazione di questi contenuti, grazie a tutti per il ...",7844,1464
La ONU responde a ELON MUSK con su PLAN para acabar con el HAMBRE en el MUNDO| Ac2ality,RnzPfHjoCyE,"La ONU ha respondido a ELON MUSK. David Beasley, el director del programa alimentario de la ONU, ha tuiteado un enlace a ...",309576,17172
Shallipopi Elon musk [lyrics video],ZEF711FnT40,,505,23
Elon Musk: The billionaire CEO who never gives up! #inspiring #shorts,qCfh8cRExp4,Elon Musk talks about why you should NEVER give up and NEVER listen to people who tell you to stop dreaming!! #inspirational ...,24393,1518
Marques Brownlee Reviews Elon Musk,iYeAWc1m08s,"What up people, the greatest tech reviewer of all time Marques Brownlee Reviews Elon Musk, builds his dream iPhone, and talks ...",38571,2684
Tesla Semi &amp; Roadster Unveil,5RRmepp7i5g,"Semi is the safest, most comfortable truck ever. Four independent motors provide maximum power and acceleration and require ...",153902,14533
Is Elon Musk a Christian Now? Listen to His Answer,cU4fkswSJhk,"After years in the works, we just released our brand-new pro-life movie, “What Is It?,” freely on YouTube! Go here to watch it now: ...",111544,15297
Elon Musk SORPRENDE a Toda La Industria Del Automóvil Con Este INCREIBLE Nuevo Motor,kyKmCmotri8,Elon Musk SORPRENDE a Toda La Industria Del Automóvil Con Este INCREIBLE Nuevo Motor Suscríbase: ...,6970,209
ELON MUSK NING ENG KATTA LOYIHALARI 🚀,ch1KCBM_d2s,МОДДИЙ ЭХТИЁЖИНГИЗДАН КЕЛИБ ЧИҚГАН ҲОЛДА КАНАЛ РИВОЖИГА МОДДИЙ ЁРДАМ ҚЎЛИНИ ЧЎЗИНГ DONAT: ...,21000,739
Elon Musk revela a terrível verdade sobre a Antártica e choca os cientistas,T-NYpmhdvSs,"Peça já seu Smartwatch Série 8 Ultra ➜ Cupom: realidade10 https://bit.ly/unr-smartwatch For Copyright issues, please message ...",8195,235
ELON MUSK (सदी का सबसे क्रांतिकारी आदमी) Best Motivational Video in Hindi,CHcGcxxHVzw,LifeMitra Ebook ₹19/- https://bit.ly/3eJDCYN ================== आलस को मार के पूरी तरह से ...,193713,3081
1 dakikada ELON MUSK #biyografi #uzay #shorts,r4jsmMxtaXc,Devamı: Elon Musk uzun video▻ https://youtu.be/xvBgtNDY1CU Diğer biyografi videoları▻ ...,154230,828
Et si Vous Passiez 24 Heures avec Elon Musk ?,vkYELSgZ8PQ,https://www.youtube.com/playlist?list=PLo5HK-FJ4q7EgVlhbYqdTKDs8_o4D1cXB Et si Vous Passiez 24 Heures avec Elon Musk ...,3149,80
Ryan Reynolds talks Elon Musk&#39;s Twitter takeover #apnews #ryanreynolds #elonmusk #twitter,DaGWlQ21mRU,,N/A,790
No Necesitas un Título 🔥🔥 Elon Musk en español,LhqqVkkZSuc,Descubre los atajos más efectivos para alcanzar tu libertad financiera en el menor tiempo posible. Regístrate en: ...,13445,315
Elon Musk OFFICIALLY Bought Ford | HUGE NEWS!,1Ud4zDObfkw,Elon Musk finally buying Ford is a huge news to the entire car industry and ev industry. As Ford and Tesla have been at extreme ...,5793,371
The Science Behind Elon Musk’s Neuralink Brain Chip | WIRED,Gv_XB6Hf6gM,"Neuralink, Elon Musk's brain chip, recently pushed back on claims that they violated animal welfare laws a few years ago, while ...",77439,6048
Elon Musk Tesla Bot (Robot Wife) #africa #robots #technology,mknxpD9Sp14,,9415,697
Elon Musk Explains Why Everyone Should Be Playing VIDEO GAMES - Kids Especially!,j9y75WHqIvg,,76436,1778
&quot;YOU&#39;RE DONE!&quot; Elon Musk Fires Tesla Employee LIVE,bO8peHF0Wc0,"Elon Musk, the CEO of Tesla sent an email to ""Everybody"" at his electric-car company late Tuesday, requesting that Tesla office ...",5897,2919
Μια μέρα στη ζωή του Elon Musk,eI8IzGJ1u6I,"elonmusk #tesla #spacex Όταν ο Ρόμπερτ Ντάουνι Τζούνιορ προετοιμαζόταν για τον ρόλο του Tony Stark Iron Man, μαντέψτε από ...",3535,166
Elon Musk Gives Jay Leno A Tour of SpaceX | Watch The Full Ep Wed 10p ET,wluBlr1j4qk,Watch the first 10 minutes of Jay Leno's exclusive tour of SpaceX with Elon Musk. The full episode of Jay Leno's Garage ...,49353,3348
RUMAH ORANG TERKAYA DI DUNIA!! ELON MUSK TESLA HOUSE!!,BHOmvMAhtf0,Klik SUBSCRIBE (100% Gratis) : https://www.youtube.com/channel/UCvc00uetYIML9D-7BBrEXLA FOLLOW INSTAGRAM ...,9603,189
Elon Musk is an addict,ZLPHYX2pBwc,Download the StudyGlows App now https://1lzl.short.gy/5jQoxG New channel link ...,430,51
Mampu Menghasilkan Uang Miliaran Dalam Hitungan detik! Begini Cara Elon Musk Menghabiskan Uangnnya,-yf-gAaygH8,"Jika mendengar nama Tesla, apa yang terlintas di ingatan kamu? Tentu saja, yang paling diingat adalah produsen mobil listrik ...",11069,914
Closeup drone video from Tesla Instagram of Elon Musk dancing at Giga Berlin’s opening.,pqOmaHXaWaM,"Elon Musk dancing at Giga Berlin's opening. Tesla's new closeup video. Giga Berlin is now in active production, making electric ...",20487,250
Rare témoignage du père Elon Musk,tFY4FSiSRj4,"Elon Musk, harcelé et battu à l'école ? Pas du tout, selon son père. Après des mois de négociation, Envoyé Spécial a pu ...",2429,321
&quot;I Tried to Warn You&quot; - Nikola Tesla Predicted Everything,A41Ays7QMMk,Nikola Tesla and Graham Hancock believe the Great Pyramid in Egypt contains a forgotten advanced technology that was ...,100692,15749
X is Worth 71% Less Since Elon Musk Acquisition,4LZ2GrwmHac,"Patrick Bet-David, Adam Sosnick, Tom Ellsworth, and Vincent Oshana discuss how X is Worth 71% Less Since Elon Musk ...",1979,528
Elon Musk&#39;s wife is a Robot,roTL4fSL_BU,AI generated images of Elon's robot wife named katenela. The first robot with artificial intelligence of female per6and ...,1392,47
Sia Unstoppable Elon Musk version,sVd1x8ry8Jo,elonmusk #Unstoppable.,9067,221
Elon Musk s&#39;est fait Humilié !,w3WMQLhNnl8,piijou.pro@gmail.com #Shorts.,81997,435
ELON MUSK: BINADAMU WA AJABU ANAYEISUMBUA DUNIA KUTOKANA NA UWEZO MKUBWA WA AKILI ALIONAO..,38vgbEUacVk,ELON MUSK: BINADAMU WA AJABU ANAYEISUMBUA DUNIA KUTOKANA NA UWEZO MKUBWA WA AKILI ALIONAO.,388,76
Elon Musk and Grimes reveal how to pronounce name of baby X Æ A-12,mLIcXQKEve0,Elon Musk and Grimes have since changed the name of their baby to X Æ A-Xii. Full story: https://abc7.la/2zkiR4c.,13710,1443
Elon Musk Stop Jadi CEO Twitter,uaSkTR-l2f4,Kira2 siapa yang cocok buat gantiin Elon Musk jadi CEO Twitter #shorts #raymondchin #elonmusk #twitter Raymond's Socials ...,60781,689
¡Elon Musk acaba de revelar que la loca fabricación de SpaceX conmocionó al mundo!,3LWu9P37YFI,Elon Musk acaba de revelar que la loca fabricación de SpaceX conmocionó al mundo! === #alphatechespañol #alphatech ...,328,31
Elon Musk ដំបូន្មានល្អបំផុតទាំង១០ ដើម្បីជោគជ័យ | Sam Kosal,kgISlnK_0sw,Elon Musk ដំបូន្មានល្អបំផុតទាំង១០ ដើម្បីជោគជ័យ | Sam Kosal ...,13210,141
"The End of Lithium P3! Elon Musk Revealed ALL-NEW Shock Battery Tech, Change Entire Industry!",Zq5FWLhlzDQ,888999evs #teslacarworld #teslacar #888999 subcribe: https://bit.ly/3i7gILj ====== The End of Lithium P3! Elon Musk Revealed ...,29120,1891
Elon Musk RÉVÈLE une vérité TERRIFIANTE sur les PYRAMIDES !,FI0gidjDxBs,Elon Musk révèle une vérité terrifiante sur les pyramides ! Elon Musk a récemment mis fin aux mythes entourant les pyramides de ...,9630,160
Elon Musk. GAS GAS GAS Meme,tyW9evRcHkc,Elon Musk. GAS GAS GAS Meme Earn Money up to $100/day through Cyrptocurrency using this link. Create an ID on Binance.,272170,11772
I Built Elon Musk’s House In 30 Days,wtvWEGMA5MM,NEW MERCH! - https://www.unspeakable.com/ PLAY NEW GAMES! - https://www.unspeakable.com/pages/play-games FOLLOW ...,13771,664
Elon Musk ‘ın 6 Başarı Sırrı (Siz de Uygulayabilirsiniz),ODeJMQ2DY-k,Elon Musk'ın Başarı Sırları Dünyanın en değerli araba markası aynı zamanda dünyanın en büyük 10 şirketinden biri olan Tesla.,32277,1248
Reality of Elon Musk Twitter Takeover | Forced $44 Billion Deal | Dhruv Rathee,85SAO5HYrjc,"Elon Musk has finally taken over twitter, and it has brought so many reactions from all around the world. Some people are ...",204962,8038
Elon Musk Explaining Tesla Model X Falcon Wing Doors🦅 ( via @joerogan ) #shorts #elonmusk #tesla,satgmlcr0AQ,The Joe Rogan Experience 1609 w/ Elon Musk: ...,272128,1917
Elon Musk Hakkında Şoke Eden İddia! | NTV,EB5CDL21WFg,Dünyanın en zengin insanı Elon Musk'ın uyuşturucu kullanımının Tesla ve SpaceX yöneticilerini rahatsız ettiği iddia edildi.,16,5
Elon Musk Digugat Karena DogeCoin?,8gieyemggtE,Menurut kalian Elon Musk itu salah apa bener? #shorts #raymondchin #dogecoin #elonmusk Kalo kalian mau belajar tentang ...,15665,276
Why Elon Musk Warned Obama About AI Technology 🤯😱,sltwaK_atHM,Elon Musk Joe Rogan Podcast Elon Musk Tunnel Investing Wealth Want a free stock? Join Robinhood today!,396682,11800
Elon Musk&#39;s Prediction for AI Future,DqH_4uJ2BOI,Subscribe to my channel. #shorts Follow the Instagram: https://www.instagram.com/declanltd/ This content doesn't belong to ...,6354,185
"Elon Musk, Zelenski&#39;ye Gününü Dar Etti: 65 Milyarlık Hesabı Milyarlarca İnsanın Önünde Sordu",Ph-HEx_Tsdk,"Henüz Abone Değilseniz, Türkiye ve Dünya'dan En Güncel Haberler İçin Haber Global'e Abone Olun: ...",1166,150
Elon Musk: Why I HATE Apple?,hP2FIfWWMpU,More Videos like this Charline Munger: Why I HATE Tesla? https://youtu.be/SzAVnkwo8I0 Charlie Munger: Why China is Better ...,440063,6190
Elon Musk: Why I HATE Apple?,hP2FIfWWMpU,More Videos like this Charline Munger: Why I HATE Tesla? https://youtu.be/SzAVnkwo8I0 Charlie Munger: Why China is Better ...,440063,6190
POR QUE Elon Musk é o MAIS RICO do PLANETA? (Elainne Ourives) | JOTA JOTA PODCAST #119,Al1YzVJCAJ4,SE INSCREVA NA LISTA DE ESPERA E GARANTA SEU INGRESSO NO PRIMEIRO LOTE    : ...,4014,291
Elon Musk&#39;s next BIG project to be the RICHEST person again! #shorts,S84CgeVCNO8,Elon Musk talks about his next big project to become the richest man in the world once again #twitter #richestman #elonmusk ...,429029,11906
Elon Musk Günde Kaç Saat Uyuyor? #shorts #elonmusk,KrqfjLyOUEg,Teknomental kanalına hoş geldiniz. Dünyanın en zengin insanı olan Elon Musk günde kaç saat uyuyor ? Çoğu milyardar 4-5 saat ...,720,3
"Rekrutacja SpaceX, Praca w Google, Elon Musk, Kodowanie Statków Kosmicznych - ft. Tomasz Czajka #39",JrQRUr_t5Rk,Dodatkowe materiały tutaj: https://www.instagram.com/przemekgorczyk/ Słuchaj na Spotify: ...,9976,569
"No, this angry AI isn&#39;t fake (see comment), w Elon Musk.",Fbc1Xeif0pY,"Tesla's Optimus robot, Elon Musk and the AI LaMDA. https://brilliant.org/digitalengine - a great place to learn about AI and STEM ...",55207,13540
ඉලෝන් මස්ක් “නියුරලින්ක්” සූදානම් කරයි. | Elon Musk Neuralink Project |,FLVJ79Fp8e4,watapita #elonmusk #neuralink ඉලෝන් මස්ක් “නියුරලින්ක්” සූදානම් කරයි. | Elon Musk Neuralink ...,7267,948
Elon Musk acusado de consumir drogas ilegales; temen que el hábito ponga en riesgo sus empresas,epP2m8f1S6g,LN+ EN VIVO las 24 horas Suscribite a LA NACION: https://bit.ly/2GU7jVv Mirá más contenidos en: ...,68,65
Na ‘drugsgebruik’ Musk: ‘Meer mensen hebben er moeite mee’,h9Zg2_BZyI4,"Volgens de Wall Street Journal gebruikt Elon Musk regelmatig verschillende soorten drugs. Het gebruik van lsd, xtc en cocaïne ...",155,193
إيلون ماسك أغنى رجل في العالم ! كيف أصبح عبقري ثرى Elon Musk,h5Fs4lR2Fag,"ايلون ماسك elon musk , قصة حياة اغني شخص بالعالم. ولد ايلون بجنوب افريقيا لام كندية واب من جنوب افريقيا ثم انتقل للعيش في كندا ...",6640,423
Paano Nawalan Ng Mahigit P10 Trillion Si Elon Musk?,volHlmpiRO4,Noong November 2021 ay $340 Billion ang net worth ni Elon Musk. Ngunit pagdating ng 2022 ay bumagsak ito sa P137 Billion.,818,92
🚀 Elon MUSK: ULTRA HARDCORE 🚀 Rafał MAZUR ZenJaskiniowca.pl,8FHnnP03n0o,Wesołych Świąt i Szczęśliwego Nowego Roku psychole #elon #elonmusk #zenjaskiniowca.,2882,279
Vom Technik-Freak zum Milliardär: Die Anfänge von Elon Musks Erfolgsstory | ZDFinfo Doku,Cox-SIhoXM4,Hier weiterschauen: Teil 2: „Höhenflüge“ ➡️ https://kurz.zdf.de/KgWd/ Teil 3: „Machthunger“ ➡️ https://kurz.zdf.de/5EL/ Im ...,3047,529
"Elon Musk Revealed All New Solar Panels for 2024 Renewable Energy, Can blow your mind!",LpQxeGtZF2o,888999evs #teslacarworld #teslacar #888999 subcribe: https://bit.ly/3i7gILj ======= Elon Musk Revealed All New Solar Panels ...,12241,673
Top 7 Inventions by Billionaire  Elon Musk | Elon Musk&#39;s Inventions | @TalkShawkYT,5pNANrGHDSg,16 Interesting Facts About World's Richest Person Elon Musk https://youtu.be/6uddodCaxHo?si=Whw3WCAm-wV89OS3 ...,719,31
Kicsoda Elon Musk? | PartizánINFO,mpVaktpN6o4,Elon Musk a 21. századi technológiai fejlődés-központú globális kapitalizmus mitológiájának központi szereplője. A self-made ...,4245,1349
ELON MUSK ESTÁ OFERECENDO UM PRÊMIO DE 1 MILHÃO PARA QUALQUER UM! #shorts,tdLGJ6q3fyE,Você pode ficar rico se achar esse lugar que o Elon Musk está procurando! Entenda o motivo do bilionário Elon Musk estar ...,285462,1221
This is how rich Elon Musk is! 😱🤯,kKsVBE7XJ5w,xplained #shorts #elonmusk #tesla #spacex.,78936,1661
Como o ELON MUSK se TORNOU quem ele É HOJE - O UNIVERSO: SÉRGIO SACANI E PEDRO PALLOTTA,5FkRXclLkwY,SÉRGIO SACANI e PEDRO PALLOTTA são amantes do vasto vazio chamado espaço sideral. Sacani tem o canal SPACE TODAY ...,3637,99
Watch Elon Musk&#39;s Neuralink monkey play video games with his brain,2rXrGH52aoM,Pager the nine-year-old macaque can now play Pong thanks to a Neuralink implanted in each side of his brain.,28477,3635
