title,video_id,description,like_count,comment_count
Does Elon Musk Believe in a Lost Civilization? - Joe Rogan,pSFrHymK2q4,joerogan #shorts #elonmusk #ancienthistory #history #youngerdryas.,643177,6071
Story of Real IRON MAN – Elon Musk | Billionaire Businessman Elon Musk life story |,WzjRI2KmS_I,One of the craziest persons in business world Elon Musk. he always is In the news for his business or for his personal life.,143521,4037
Elon Musk - I Don&#39;t Ever Give Up | Gangsta&#39;s Paradise,43TmnIaL3n4,"To the Moon Song: ""Elon Musk gangsta paradise"" Mix (Mikael Kun)(i dont ever give up)",1197555,34906
Elon Musk vs MrBeast,e7nSoi9D7zQ,HELP ME REACH 500 SUBSCRIBERS - Subscribe to my channel: ...,53411,1193
Elon Musk - People Don&#39;t Realize What&#39;s Coming!,1wotmu1KL0E,"Elon Musk is the charismatic co-founder of PayPal and Tesla, as well as the founder of SpaceX, Neuralink, and The Boring ...",107720,26095
Angebliches Drogenrausch Meeting: Original Video von Tesla / SpaceX Chef Elon Musk bringt Klarheit,l7JZwpXrHVc,Das Wall Street Journal veröffentliche einen Artikel zu Elons Musks angeblichen illegalen Drogenkonsum. War Elon tatsächlich ...,733,77
Elon Musk CRIES Over John Oliver Roast In Humiliating Escalation,K1cqy1F9D8s,Elon Musk still cannot handle getting brutally roasted by John Oliver as he goes off on him randomly during bitter X rant.,9409,2315
💸🤯JULES über ELON MUSK - REICHSTER MENSCH der WELT REAKTION  | Trymacs Stream Highlights,K1cXmDqtMds,Heute reagiert Max auf das neue Video von Jules! Original Video: ...,15263,262
O PLANO DO IRMÃO DE ELON MUSK (Kimbal Musk). #shorts #elonmusk,t6y0Ti9IO_k,Curso de Inglês para você evoluir: https://hotm.art/inglesmilionario Conheça as profissões do futuro: ...,72455,475
Why Elon Musk Sold Tesla,5nvI7NcZ77w,How To Make $1000 Per Day: https://youtu.be/nfNUnIgMmso?si=RWP4HjdrI0kvfu86 New Podcast Episode: ...,180,21
"Michelle Obama for President, Elon Musk&#39;s Alleged Drug Use | PBD Podcast | Ep. 347",BtCRdC0qmeA,"Patrick Bet-David, Adam Sosnick, Tom Ellsworth, and Vincent Oshana discuss the Wall Street Journal report that Elon Musk's drug ...",14312,2019
La Simple Técnica de Elon Musk para Aprobar en la Escuela #ElonMusk #spacex #tesla,qfX_bcziJXY,,47703,348
Kekayaan Elon Musk ga ada apa2nya dibandingkan pria ini,OXSo0d6whks,,169715,2514
Elon Musk: &quot;Oumuamua is Suddenly Speeding Towards Earth. It is NOT ALONE...&quot;,1sUK7DTjzf0,Become a Musk Fan today!   https://www.youtube.com/channel/UCXAWX5r69jcqPTNAhXCSA7Q/join Copyright or other ...,1308,6
Elon Musk Can’t Save Free Speech,79pS5OXKTkU,Watch this video ad-free on Nebula: https://nebula.tv/videos/tomnicholas-why-elon-musk-couldnt-save-free-speech A video about ...,22683,2900
ELON MUSK BUYS A MCLAREN!!,N411XggtP84,,406089,3600
Elon Musk Speaks On Exiling his Transgender Daughter,VvKJzROmu84,Elon Musk Speaks On Exiling his Transgender Daughter Elon Musk's daughter Vivan - formerly known as Xavier - recently ...,6658,5685
Elon Musk On The Big Bang Theory,KGR5HP3KSBk,Elon Musk On The Big Bang Theory.,369560,12003
Tóm tắt cuộc đời Elon Musk - Tạo ra SpaceX vì đi mua tên lửa mà Nga không bán,Oa5-ULyEESI,"Tóm tắt cuộc đời Elon Musk - ""Kẻ nổi loạn thay đổi Thế giới"" ------------------------------------------ Đừng bị dụ dỗ bởi những lời đường ...",12154,526
AI is Becoming Conscious! ELON MUSK was Right About The Greatest Threat To Humanity,R4iJMIgj6ZI,"AI i.e Artificial intelligence is getting more conscious day by day. With the arrival of Machine learning, This consciousness has ...",94107,4136
Elon Musk Reveals Plan To Colonize Mars,jXPj66c_dqA,"Elon Musk Reveals Plan To Colonize Mars. For years now, the whole science world has been thrown into a debate on the ...",41482,3758
Elon Musk on How the Neuralink Brain Chip Works | JRE #jre #tesla #elonmusk,fKjR2ELIrKo,,441,38
Elon Musk confirma: &quot;El rapto sucederá MUY pronto...&quot;,DT7dxUJ7ll0,"Descubre la trascendencia espiritual, una creación conmovedora que ahonda en la fortaleza de la fe y la esperanza, guiando a ...",1064,160
"Elon Musk - Ludzie nie wiedzą, co nadchodzi!",OJ5AVHZ4aFA,"W świecie, który szybko się zmienia i stoi w obliczu bezprecedensowych wyzwań, Elon Musk jest nie tylko głosem najbardziej ...",1623,324
Elon Musk Spotted in Public,B7COOrywno8,Elon Musk Spotted in Public.,7278,485
A Day In The Life of Elon Musk,40gvqs4wHJ4,A Day In The Life of Elon Musk. What would it look like to live a day in the life of Elon Musk? Not only is Musk the world's richest ...,22482,1092
Elon Musk: Advice for Young People | Lex Fridman Podcast Clips,M-ZH3psUbfU,Lex Fridman Podcast full episode: https://www.youtube.com/watch?v=DxREm3s1scA Please support this podcast by checking out ...,48728,1137
How Elon Musk Became World&#39;s Richest Man Overnight ?,aFUT7poMlHM,ZemTV Shorts: https://www.youtube.com/@zemtv.shorts Face Reveal & QNA: https://youtu.be/zPXVS88OS2s How Elon Musk ...,208224,2741
Bad History - ELON MUSK (Singularity),dDakzFJfZ4c,"This is the 5th episode of the Bad History  , featuring Elon Musk. Hope you enjoy it! Support us by joining the 'Bad History Club' ...",224296,9859
🚨 URGENTE: ELON MUSK FALA SOBRE O NOVO MOTOR A HIDROGÊNIO E PODE MUDAR A INDÚSTRIA DOS ELÉTRICOS,u6RPMoZfS_I,Leia mais aqui ↓↓↓ Gostou do meu trabalho e quer me apoiar? Torne-se membro do canal e tenha acesso a conteúdos ...,984,37
Elon Musk apresenta novos detalhes do seu robô humanoide,ZhuzYTe5Jc0,"Peça já seu fone Lenovo GM2PRO Gamer ➜ Cupom: realidade10 https://bit.ly/unr-fonegm2 For Copyright issues, please ...",843,45
Jack Ma and Elon Musk hold debate in Shanghai,f3lUEnMaiAU,Alibaba co-founder and executive chairman Jack Ma and Tesla CEO Elon Musk hold a debate in Shanghai over artificial ...,81015,25599
Elon Musk and his team knows how to bounce back 🚀| Tesla Cybertruck | #shorts #elonmusk #cybertruck,qqZc3jGXTJY,,N/A,2772
IT HAPPENED! Elon Musk JUST Announced 2024 Presidental Run,BqDIPzYkivM,"In a recent elon musk podcast, the tesla ceo discussed possibly going by elon musk president instead. many elon musk interview ...",311,139
How Elon Musk became World&#39;s Richest Man? | Dhruv Rathee,m-58eOTlodQ,What is the secret behind Elon's success? How will Elon Musk become the first Trillionaire in the world? In this video I show you ...,184932,6356
Elon Musk&#39;s 3 Rules To Learning Anything,XK6MyKmIew8,"I do think there's a good good framework for thinking it is physics you know the sort of first principles reasoning generally, What I ...",49149,1415
&#39;&#39;Is Reading Important?&#39;&#39; - Elon Musk,N--hz7XiZG8,Elon Musk talks about reading. Elon Musk loves to read books and in this video he talks about how important is reading. This is a ...,20756,679
Elon Musk MOST SHOCKING INTERVIEW With AI!,dUhvvoVtpVE,"Elon Musk URGENT WARNING: ""You Need to WATCH THIS Interview!"" Subscribe now with all notifications on for more Elon ...",13960,1381
Animator reveals true scale of Elon Musk’s wealth #animation,wjD34KKHU1k,Discover the shocking truth about the immense wealth of Elon Musk and other billionaires in this eye-opening Short. Join us as we ...,280274,6166
How Elon Musk Became World&#39;s Richest Man Overnight ?,aFUT7poMlHM,ZemTV Shorts: https://www.youtube.com/@zemtv.shorts Face Reveal & QNA: https://youtu.be/zPXVS88OS2s How Elon Musk ...,208224,2741
Jack Ma and Elon Musk hold debate in Shanghai,f3lUEnMaiAU,Alibaba co-founder and executive chairman Jack Ma and Tesla CEO Elon Musk hold a debate in Shanghai over artificial ...,81015,25599
Bad History - ELON MUSK (Singularity),dDakzFJfZ4c,"This is the 5th episode of the Bad History  , featuring Elon Musk. Hope you enjoy it! Support us by joining the 'Bad History Club' ...",224296,9859
A HISTÓRIA DE ELON MUSK,iRJj9kirNPs,Curso Viver de YouTube ↓ https://bit.ly/C88674068T Aprenda a Fazer Vídeos Como Esse ...,6793,307
Elon Musk and his team knows how to bounce back 🚀| Tesla Cybertruck | #shorts #elonmusk #cybertruck,qqZc3jGXTJY,,N/A,2772
&#39;&#39;Is Reading Important?&#39;&#39; - Elon Musk,N--hz7XiZG8,Elon Musk talks about reading. Elon Musk loves to read books and in this video he talks about how important is reading. This is a ...,20756,679
Elon Musk&#39;s 3 Rules To Learning Anything,XK6MyKmIew8,"I do think there's a good good framework for thinking it is physics you know the sort of first principles reasoning generally, What I ...",49149,1415
IT HAPPENED! Elon Musk JUST Announced 2024 Presidental Run,BqDIPzYkivM,"In a recent elon musk podcast, the tesla ceo discussed possibly going by elon musk president instead. many elon musk interview ...",311,139
Elon Musk MOST SHOCKING INTERVIEW With AI!,dUhvvoVtpVE,"Elon Musk URGENT WARNING: ""You Need to WATCH THIS Interview!"" Subscribe now with all notifications on for more Elon ...",13960,1381
Go up SpaceX&#39;s Starship-catching robotic launch tower with Elon Musk!,XP5k3ZzPf_0,"Today we're going up SpaceX's Orbital Launch Tower with the ultimate tour guide, Elon Musk. He's going to walk us around the ...",74845,6250
Elon Musk apresenta novos detalhes do seu robô humanoide,ZhuzYTe5Jc0,"Peça já seu fone Lenovo GM2PRO Gamer ➜ Cupom: realidade10 https://bit.ly/unr-fonegm2 For Copyright issues, please ...",843,45
How to Create a Company | Elon Musk&#39;s 5 Rules,Qa_4c9zrxf0,"Starting and growing a business is as much about the innovation, drive and determination of the people who do it as it is about the ...",119649,2448
Elon Musk&#39;s Advice For College Students,kCqKXt4PXRM,"In this video, the reporter asks Elon Musk to help his son choose a subject to choose for his higher studies.. - Full Clip: ...",39393,501
Does Elon Musk Have A Drug Problem?,yKLWDzaGDZk,WSJ reports on Elon Musk potential drug problem. Apple announces the release of the Vision Pro headset. People are cancelling ...,1313,168
Starbase Tour with Elon Musk [PART 1 // Summer 2021],t705r8ICkRw,"Join me as I take a tour of SpaceX's Starbase facility with Elon Musk as our tour guide! This is part 1 of 3, so stay tuned, there's a ...",226579,17509
Tesla ஊழியரை தாக்கிய Robot | Elon Musk க்கு புதிய தலைவலி | Mr.GK,0WWIEXcijwY,"Download link: https://kukufm.page.link/XVeEECwnAWNqWN5o9 Coupon code: MRGK50 (Note : For IOS Users, Kindly use the ...",7793,211
KID YUGI - ELON MUSK (prod. hellizard),lBYC3GCGQyE,Kid yugi - elon musk (prod. hellizard) Video diretto da - Alessio Mariano Riprese di - Alessio Mariano & milkycrushlies.,5163,135
🔥 7 Bí Ẩn Ly Kỳ Và Thú Vị Về Tỷ Phú Elon Musk Người Giàu Nhất Hành Tinh | Kính Lúp TV,V6OE5TLCf-I,Chào mừng các bạn đến với kênh KÍNH LÚP TV trong video ngày hôm nay chúng ta hãy cùng đến với: 7 Bí Ẩn Ly Kỳ Và Thú Vị ...,4477,293
"Major investor shuts down Elon Musk drug-use claims: He’s ‘serious, focused’ #shorts",_DVaxWYO1nk,"ARK Invest's Cathie Wood came to Elon Musk's defense, denying any accusations of drug use by one of the most 'serious and ...",987,99
Elon Musk Shares How Many Hours of Sleep He Needs to Be Productive!,cDTqnpzUAAc,,31604,292
Marlon Wayans Says Elon Musk Owes Him $30K,kFwHE42tlag,Marlon Wayans explains why he wants $30000 back from Elon Musk after buying a new Tesla. Watch the full interview on ...,274536,1632
Elon Musk Just Said the Greatest Thing of All Time,rQvIvauTX7Y,"This week the left is trying to cancel Elon Musk for anti-semitism. In a tweet, Musk compared George Soros to supervillain Magneto ...",26896,2489
Elon Musk | Whatever it takes | 2K Subscribers Special | Motivational Video | Elon Musk Nation,lyapd6AN028,"Elon Musk | Whatever it takes | Motivational Video | Subscribe to my channel, it helps me keep going. Business inquiries?",5477,281
Elon Musk On Sleep Time And Breakfast,xgwbPtegPrw,"Answer to questions: ""How much does Elon Musk sleep? What kind of breakfast does he have?"" Сontact for any questions: ...",115079,1300
10 Interesting Facts About Elon Musk - Elon Musk Facts in Hindi - Wonder Facts Hindi,WA2Zh3L3Aog,10 Interesting Facts About Elon Musk - Elon Musk Facts in Hindi - Wonder Facts Hindi #ElonMusk #Shorts #wonderfacts ...,23775,34
Inside the life of Elon Musk Bodyguards,QOrLglEoT3M,Elon Musk's - Tesla & SpaceX CEO security team is comprised of a well-trained group of bodyguards who are responsible for Elon ...,2029,171
which model does Elon musk use? #tesla #modelx #luxurycars,4yGX9C-FzKA,Ytshorts #newcars #buying #modelx #news Subscribe now:-   https://youtube.com/@UCM7YFtMVECIHstVt2KsJ35A @tesla ...,30912,766
Elon Musk - Never Give Up | Gangsta&#39;s Paradise,sQIx6YeMRR8,Elon Musk - Never Give Up (Gangsta's Paradise) Decided to make a trailer-style video that is dedicated to Elon Musk's journey.,136566,2847
Elon Musk | Hall of Fame | HD Tribute | 2019-2020 | also Subscribe please !,j_r9QlY60E8,"Subscribe to my channel, it helps me keep going. Business inquiries? Request my email using the button on our 'About' page!",23256,1299
SpaceX Evolution from 2002 to 2022 🔥🔥🚀🚀 #shorts #spacex #starship #elonmusk,Cjw7YFdVcMk,,86365,693
"This intense AI anger is exactly what experts warned of, w Elon Musk.",b2bdGEqPmCI,"AI, Ameca, Elon Musk and Boston Dynamics. A big month for AI. Please visit https://brilliant.org/digitalengine - a great place to ...",108120,18957
&quot;I Tried To Warn You&quot; - Elon Musk LAST WARNING (2024),9jkRcrM6XKA,Become a MUSK FAN & get access to perks: https://www.youtube.com/channel/UCXAWX5r69jcqPTNAhXCSA7Q/join ...,205052,17890
"Essere Elon Musk, la serie completa: vita, segreti e lati oscuri di un visionario",fAFma2ye64k,"Nella serie prodotta da Italian Tech e Gedi Visual, la vita, le idee e i segreti del visionario Ceo di Tesla e SpaceX che il 24 ...",1820,114
Elon Musk VS Mark Zuckerberg #shorts,JiK0LDbJ_D0,"Elon Musk VS Mark Zuckerberg #shorts credits: Norske Viraler from TikTok Welcome to my channel guys! in this video, I'm gonna ...",11781,553
Watch: Elon Musk Dances Again at Tesla Factory Opening,y5uV6qLYqMQ,Tesla officially opened its plant outside Berlin on Tuesday and rolled out 30 Model Ys to customers. CEO Elon Musk followed ...,46892,4839
Elon Musk Tweets; Read by Wheatley From Portal 2...,WKYVk8K_Uxc,I made a part 3 Join my Discord to have your name in the next video! https://discord.jacksnotreal.com ——- Shoutout to these ...,18569,858
Elon Musk သုညဘဝကနေ ကမ္ဘာ့အချမ်းသာဆုံး billionaire ဘယ်လိုဖြစ်လာတာလဲ။,ic1yAQ0Z7fM,လူတစ်ယောက်အောင်မြင်နေတာကိုမြင်ရင် ဒီအတိုင်းလေးပဲ ...,8223,160
Elon Musk on PM MODI&#39;S Leadership 🇮🇳🚀,emAWjOSelDY,"When asked about a timeline for Tesla coming to India, Musk said, ""I am confident Tesla will be in India and will do so as soon as ...",243414,2439
Elon Musk: Things are getting weird fast,MpSvyWLEu8M,Twitter CEO Elon Musk provides insight on the consequences of developing artificial intelligence and the potential impact on ...,64666,11659
Elon Musk Biography ||Best Motivational speech in telugu || Br Shafi,Q7Jaz3f0N7Y,Good News Now Br Shafi's Online Workshops @ 60%off for more details Call 9811220385 1.How to earn Money ? 2hrs30min ...,32859,525
Elon Musk (SpaceX) - Gangsta&#39;s Paradise,fAz8rLQmbKw,"I don't monetize these videos. Maybe if you want to support me, here is my ETH/BSC address: ...",133771,5264
they THREATENED me to keep this quiet.,owPMPikndao,Become a Musk Fan today!   https://www.youtube.com/channel/UCXAWX5r69jcqPTNAhXCSA7Q/join Copyright or other ...,3543,14
"The Talented Mr. Musk, Part 2: The Elon Files – SOME MORE NEWS",r-Y7U4LOTYY,"Hi. For Part 2, we look at how The Twitter Files don't show the kind of nefarious intent that Elon Musk hoped they would, and ...",34664,4037
Elon Musk Tells Us What The Navy Saw While Diving in the Ocean,al1VZh4_FEk,The depths of the ocean have fascinated humans for ages. We have traveled the blue horizons in search of new civilizations and ...,8300,489
This AI says it&#39;s conscious and experts are starting to agree. w Elon Musk.,xvNvj7ku5pY,"Elon Musk and ""conscious AI."" Please visit https://brilliant.org/digitalengine - a great place to learn about AI and STEM subjects.",133173,24457
👽 ELON MUSK’S TERRIFYING ALIEN PREDICTION!,TqWbMZIQAoo,ELON MUSK'S “FRIGHTENING” ALIEN PREDICTION! #shorts SUBSCRIBE: ...,818,44
Joe Rogan: Elon Musk On The ICE AGE Rabbit Hole,a7iaUTPurjQ,FREE Alpha Brain Trial! - https://onnit.sjv.io/qnrxJY FREE Shroom Tech® Sport Trial - https://onnit.sjv.io/GjrVxE Onnit Affiliated ...,22476,3394
Discurso de Elon Musk te dejará SIN PALABRAS  | Uno de los discursos más reveladores de la historia,0KR8m2DqhPI,"Elon Musk, fundador y consejero delegado de SpaceX y Tesla, fundador de The Boring Company y cofundador de Neuralink y ...",56669,1206
Elon Musk’s Favourite Job Interview Question (can you answer?),GIcRivlcKTw,shorts #jobinterview #elonmusk.,821384,25960
Elon Musk finally opens up about GOD...,_sdT9x4HQt8,Become a Musk Fan today!   https://www.youtube.com/channel/UCXAWX5r69jcqPTNAhXCSA7Q/join Copyright or other ...,734,21
Elon Musk Works 120 Hours Every Week😳,lOSZQfYqdDI,"shorts #elonmusk SUBSCRIBE for your daily dose of Elon: https://bit.ly/3PkvdMl Elon Musk, Trillionaire, Tesla, SpaceX, Dogecoin, ...",7360,314
Elon Musk New Tesla Robot || #shorts #youtubeshorts #short #tesla #youtube #trending #trendingshorts,DB1027Bfpmo,"Elon Musk New Tesla Robot In this video, we discuss the latest innovation from Tesla - the new Tesla Robot unveiled by Elon ...",53966,4985
This AI says it&#39;s conscious and experts are starting to agree. w Elon Musk.,xvNvj7ku5pY,"Elon Musk and ""conscious AI."" Please visit https://brilliant.org/digitalengine - a great place to learn about AI and STEM subjects.",133173,24457
Young Elon Musk - Interview 2007 - Full Version,iaLhVwOf9Vk,Young Elon Musk - Interview 2007 - Full Version The lost and rare interview of Elon Musk in 2007 with PBS Wired Science ...,6684,1357
Elon Musk&#39;s 2003 Stanford University Entrepreneurial Thought Leaders Lecture,afZTrfvB2AQ,"Here's a very interesting (and prescient) talk by Elon Musk (founder of SpaceX, Tesla Motors and X.com/PayPal). (October 08 ...",1570,104
Why Elon Musk does NOT pay taxes explained by Jaspreet Singh🤓📈💸,f3-EKY7CBds,finance #investing #money #jaspreetsingh #shorts.,719268,9946
I Tracked Down Elon Musk To Hand Him My Resume,FxafASrcLgM,Check out Airup and taste with your nose here - https://airup.link/3OfszY0 Hire me father Instagram: ...,58132,1525
Elon Musk shows off bizarre dance moves at Tesla event in China,U0sJJU3FaOQ,Elon Musk performed an interesting dance routine at the launch of Tesla's Model Y electric sports utility vehicle program at its new ...,71574,10414
Elon Musk on: Religion &amp; Philosophy,Ai0frcon0E8,Full interview produced for @TeslaOwnersSV https://www.youtube.com/watch?v=iHmSrK238vI.,147441,5301
FIRST Tesla Female Humaniod Robot Elon Musk&#39;s NEW AI Girlfriend,GiYuEElxskw,FIRST Tesla Female Humaniod Robot Elon Musk's NEW AI Girlfriend Elon Musk recently stated that Tesla AI Day has been ...,1001,129
&quot;Those Bastards&quot; - Elon Musk to the SEC😳 #shorts,YV32QOXiOEI,"shorts #elonmusk SUBSCRIBE for your daily dose of Elon: https://bit.ly/3PkvdMl Elon Musk, Trillionaire, Tesla, SpaceX, Dogecoin, ...",156375,4658
ইলন মাস্কের কিছু মূল্যবান কথা | Life Changing Elon Musk Quotes | Bangla Motivational Video,9cLQNgvnhkQ,ইলন মাস্কের কিছু মূল্যবান কথা | Life Changing Elon Musk Quotes | Bangla Motivational Video In this ...,14055,190
O Plano INSANO De Elon Musk Para 2024 Vai Revolucionar a Humanidade!,9quvT_32ORs,O Plano INSANO De Elon Musk Vai Revolucionar a Humanidade em 2024! Elon Musk acaba de lançar nova inteligência artificial ...,772,49
"Elon Musk faz uso de drogas com LSD e ketamina e preocupa investidores, diz jornal",4qnNmMyFnJE,"O jornal americano Wall Street Journal publicou uma reportagem em que diz que o empresário e dono de plataformas com X, ...",381,348
Bakit Ibinenta Ni Elon Musk Ang Lahat Ng Mansion At Tumira Sa Napakaliit Na Bahay?,cCTYOCwkDhA,Bakit kaya ibinenta ni Elon Musk ang lahat ng kaniyang mga mansion at lumipat sa napakaliit na bahay? Si Elon Musk ay ang ...,2729,403
Elon Musk | सदी का सबसे क्रांतिकारी आदमी | Case Study | Dr Vivek Bindra,5CFZZHF-zjA,Watch the amazing case study of the most revolutionary man of the century - Elon Musk Elon Musk is a visionary business ...,647619,24378
Elon Musk on living with Asperger&#39;s syndrome,hzlbYvw-5gk,This is a channel dedicated to spreading Elon Musk's values and news. We don't want world to hate anyone. Spread love and get ...,5005,350
Elon Musk priznao da je iz Republike Srpske😳? #youtubeshorts #serbia #shortsviral #viral #balkan,7iUoWb3L7AY,,8194,750
ELON MUSK का MARS पर बस्ती बसाने का GENIUS PLAN Elon Musk&#39;s Plan to Colonize Mars,zhiTP62ke_M,"Register with Coinswitch Kuber and get FREE Bitcoin worth Rs.50 - https://coinswitch.co/in/refer?tag=eDq4 Hello friends, did you ...",239398,17127
Elon Musk Drug Use Concerns Business Leaders,iAk83y0pG2M,"Kara Swisher and Scott Galloway discuss Elon Musk's drug use and the repercussions for his businesses, then get some medical ...",536,153
La présentation ratée des premiers Cybertruck d&#39;Elon Musk,FBIR3PjfppM,"Jeudi 30 novembre, Elon Musk livrait les dix premiers Cybertrucks aux clients américains ayant passé commande. Mais tout ne ...",19946,523
"Kelakuan Aneh Elon Musk, Orang Kaya Tapi... #shorts",3xGzBxn2D4Y,"Elon Musk, Tesla, SpaceX, Bitcoin.",119158,781
Tỉ Phú Elon Musk Đã Làm ĐIỀU BẤT NGỜ Cho Người Đàn Ông Này #shorts,JOj2M-Y9jpA,,5321,74
যেভাবে গড়ে ওঠে ইলন মাস্কের সাম্রাজ্য | Elon Musk | Richest Man in The World | Somoy TV,FszaOcI3j-g,elonmusk #richestpersonintheworld #somoytv যেভাবে গড়ে ওঠে ইলন মাস্কের সাম্রাজ্য | Elon ...,11101,299
😱Elon Musk DESPIDE en DIRECTO por TWITTER a un INGENIERO !! 😱  #shorts,58ToeSf4YPM,"Elon Musk despide por Twitter a un ingeniero que ""se atrevió"" a contestar una queja del nuevo CEO. Scalable Capital ...",150319,4839
J.Waller Will NEVER Be Elon Musk #motivation #jwaller #mindset,68ng-HahxXk,,290,4
Elon Musk onun uğur hekayəsi və gənclərə məsləhətləri | milyarderin məsləhəti | millionairesis,w8aPQyUsCxY,Elon Musk onun uğur hekayəsi və gənclərə məsləhətləri | milyarderin məsləhəti | millionairesis Buyurun dostlar düşünürəm bu ...,1082,38
Warren Buffett on Elon Musk &amp; Tesla,UyStA_FinfY,shorts #ElonMusk #WarrenBuffettTesla Watch the 2021 Berkshire Hathaway Annual Shareholders Meeting on YouTube: ...,3085,358
ELON MUSK: Ο Μάικλ Τζόρνταν του καπιταλισμού - BigBusiness #14,sjrzC2Hlato,https://bit.ly/freedom24-mikeius Θέλετε να επενδύετε με 0% προμήθειες; Ανοίξτε τον επενδυτικό λογαριασμό σας στη Freedom24 ...,15676,492
Elon Musk Just Said THIS About WFH 😳,F8CZV3NTmCQ,,60867,8315
Elon Musk - In The End,G94z-xcBp6o,ElonMusk #Tesla #SpaceX #InTheEnd Song - In The End (Linkin Park Epic Cover) - Tommee Profitt (feat. Fleurie & Jung Youth) ...,1665,70
யார் இந்த எலான் மஸ்க்? | Who is Elon Musk? | Biography of Elon Musk | TESLA | Twitter,KMcsQH4VVJc,"ElonMusk | #Tesla | #WhoIsElonMusk Sun News (சன் நியூஸ்) brings to you the latest Information on Sports, Business, ...",1989,68
Elon Musk Family Tree,cnb-uNTo28w,Thank you to Wondrium for sponsoring today's video! Signup for your FREE trial to Wondrium here: http://ow.ly/4pQU50LVqK8 ...,6876,970
Tesla CEO Elon Musk Smokes Weed During Joe Rogan Podcast Interview | Velshi &amp; Ruhle | MSNBC,1rS8fFbW57o,"Tesla stock plunged 9 percent on Friday after a bizarre podcast in which CEO Elon Musk smoked weed and sipped whiskey, and ...",21385,4125
Elon Musk&#39;s Crazy Daily Routine!😳,L42zi4EDV0g,"shorts #elonmusk SUBSCRIBE for your daily dose of Elon: https://bit.ly/3PkvdMl Elon Musk, Trillionaire, Tesla, SpaceX, Dogecoin, ...",1460,39
Elon Musk JUST UNVEILED Insane NEW Hypersonic Aircraft Which Outperfoms US Fighter Jets!,i_reHlBvOSg,Elon Musk JUST UNVEILED Insane NEW Hypersonic Aircraft Which Outperfoms US Fighter Jets! Imagine a hypersonic aircraft ...,312,20
"Elon Musk - Die Menschen wissen nicht, was auf sie zukommt!",eX5TRDHy9mE,"In einer Welt, die sich rasant verändert und die vor beispiellosen Herausforderungen steht, ist Elon Musk nicht nur die Stimme ...",1063,641
Elon Musk não deixará suas empresas para seus 9 filhos #shorts,gUs3PZZax6Y,,106473,1195
Thú Chơi Xa Xỉ Đỉnh Cao Của Tỷ Phú Elon Musk | Giới Thượng Lưu,9lIp6SKF1VQ,Thú Chơi Xa Xỉ Đỉnh Cao Của Tỷ Phú Elon Musk | Giới Thượng Lưu #gioithuongluu #ThuongLuu #gioitinhhoa ...,5087,369
Elon Musk- never give up,bheHjqvkaaI,"I know there are tons of these videos out there, but I just felt like doing one by myself, simply because of the awesomeness of Elon ...",80210,3529
Mark Zuckerberg reacts to Elon Musk possibly buying Twitter #shorts,Zwp8AQN4Qa4,"Mark Zuckerberg on Elon Musk possibly buying Twitter: “I think it's interesting as a saga… but I think even at this point, it's not ...",42265,2543
Elon Musk: The Ultimate Car Salesman,dD9KVlnvVds,From JRE #1169 with Elon Musk.,298,9
